title,date
Home secretary won't say how many migrants will be returned to France in new scheme,2025-08-05 09:40:41.000000
The Repair Shop's Jay Blades charged with rape,2025-08-05 08:44:17.000000
"Putin and Trump's relationship has soured - but behind the posturing, a Ukraine deal is still possible",2025-08-04 23:22:06.000000
Thousands without power and trains suspended in wake of Storm Floris,2025-08-05 09:27:24.000000
"Disfigured, shamed and forgotten: BBC visits the Korean survivors of the Hiroshima bomb",2025-08-04 22:04:35.000000
£100m of premium bond prizes remain unclaimed,2025-08-05 00:59:32.000000
"Police should be more transparent about suspects' ethnicity, home secretary says",2025-08-05 08:33:38.000000
Footballer Thomas Partey granted bail on rape charges,2025-08-05 09:22:12.000000
Danish zoo asks for unwanted pets to feed its predators,2025-08-04 19:45:12.000000
Trump attacks 'woke' Jaguar as firm names new boss,2025-08-05 04:44:27.000000
"He is a human skeleton, Gaza hostage's brother tells BBC",2025-08-04 17:05:21.000000
'Totally torn apart': How decline of Morecambe FC threatens a whole community,2025-08-04 17:36:12.000000
Why Donald Trump is talking about actress Sydney Sweeney,2025-08-05 00:50:00.000000
Miracle product or pollution nightmare? Why a deal to cut plastic waste is hard to reach,2025-08-05 04:03:43.000000
My twin sister and nieces were shot dead. Tighter gun rules make me feel hopeful,2025-08-04 23:45:58.000000
Who pressed their Ashes case? Who disappointed? England's player ratings,2025-08-04 15:24:14.000000
"Chris Hemsworth on facing fears, ageing and return of Thor",2025-08-04 23:08:47.000000
Adoption support charity shreds 'irreplaceable' files to save space,2025-08-05 05:19:28.000000
Texas Republicans vote to arrest Democrats blocking plan to re-draw electoral boundaries,2025-08-05 08:59:51.000000
"Patients stopping obesity jabs need help to keep weight off, NHS told",2025-08-04 23:00:10.000000
I'm a bodybuilder but bowel cancer in my 30s nearly killed me,2025-08-05 04:58:50.000000
Police officer accused of sharing Manchester Airport brawl CCTV footage,2025-08-05 09:12:50.000000
BP says it makes biggest oil and gas find in 25 years,2025-08-05 09:01:29.000000
Love Island 2025 winners revealed after drama-filled series,2025-08-04 22:39:18.000000
BBC News app,2025-04-30 14:04:28.000000
Why has Sydney Sweeney's jeans ad sparked a race debate?,2025-08-04 17:53:00.000000
The Battle For Car Finance Compensation,2025-08-01 18:28:00.000000
Documents are discovered from the Moors Murders,2025-07-30 05:00:00.000000
'Winning the Ashes would be Stokes' greatest miracle',2025-08-05 05:18:19.000000
'Excellent prospect' Ngumoha stars for Liverpool - but who is the 16-year-old?,2025-08-04 21:00:52.000000
'I needed to get myself together' - Fitzpatrick on finding form,2025-08-05 05:35:30.000000
Will McLaren be worried about Norris-Piastri relationship?,2025-08-05 06:45:52.000000
Mboko reaches semis to continue dream Montreal run,2025-08-05 06:34:50.000000
The final year of The Hundred as we know it?,2025-08-05 08:21:31.000000
Scores dead as boat carrying more than 150 people capsizes off Yemen,2025-08-04 15:26:52.000000
Gunmen kidnap more than 50 people in north-west Nigeria,2025-08-03 18:10:46.000000
Family of Kenyan woman allegedly murdered by UK soldiers criticise defence secretary,2025-08-03 14:00:42.000000
Kemi Badenoch says she no longer sees herself as Nigerian despite upbringing,2025-08-01 17:17:49.000000
Rhino horns made radioactive to foil traffickers in South African project,2025-07-31 21:52:16.000000
Scientists identify bacterium behind devastating wasting disease in starfish,2025-08-05 06:57:17.000000
US condemns Brazil supreme court judge for ordering house arrest of ex-president Jair Bolsonaro,2025-08-04 22:25:37.000000
"Nine missing, including child and Irish missionary, after mass kidnapping at Haiti orphanage",2025-08-04 20:55:54.000000
Canada wildfires prompt severe air quality alerts across country and US,2025-08-04 17:55:49.000000
BP makes its biggest oil and gas discovery in 25 years off coast of Brazil,2025-08-04 13:56:14.000000
‘Don’t erase the soul of Bingin’: Bali locals dismayed as 48 businesses destroyed in local crackdown,2025-08-04 15:00:35.000000
Weather tracker: Heat records fall as Japan and South Korea swelter,2025-08-04 11:05:57.000000
New Zealand to charge foreign tourists to visit most famous sites,2025-08-04 04:36:35.000000
South Korea begins removing loudspeakers on border with North to reduce tensions,2025-08-04 03:56:25.000000
Woman arrested after allegedly travelling with two-year-old in suitcase in New Zealand,2025-08-03 17:21:21.000000
"Exchange student, 13, in custody after 14-year-old girl fatally stabbed at NSW host family home",2025-08-05 09:18:36.000000
Snowtown murderer granted parole after decades in jail for South Australia’s ‘bodies in the barrels’ serial killings,2025-08-05 08:53:42.000000
"Transgender woman treated as ‘hostile invader’ when joining women-only app Giggle for Girls, court hears",2025-08-05 08:26:49.000000
‘Grave’ fears for missing couple and dog after plane vanishes flying from Tasmania to NSW,2025-08-05 08:02:34.000000
Qantas frequent flyer points devalued as airline rolls out changes to loyalty program,2025-08-05 08:02:02.000000
Ukraine calls for greater pressure on Russia ahead of Witkoff visit – Europe live,2025-08-05 10:02:42.000000
Guinness owner Diageo’s profits slump as it warns of $200m Trump tariff hit,2025-08-05 08:42:13.000000
Shein fined €1m in Italy for misleading environmental claims about products,2025-08-05 05:00:42.000000
Pension age debate threatens to splinter Germany’s fragile coalition,2025-08-05 04:00:41.000000
UK to start small boats returns to France ‘within days’ after EU gives green light,2025-08-04 21:30:33.000000
Israel-Gaza war live: Netanyahu to meet security cabinet to decide on next steps in war,2025-08-05 09:56:25.000000
‘Heartbreaking’: a London surgeon on the trials of operating in a Gaza hospital,2025-08-05 08:40:18.000000
100 Gaza children hope to be evacuated to UK for urgent medical care,2025-08-05 05:00:43.000000
More than 40 arrested at protest against Gaza war at Trump hotel in New York,2025-08-05 02:19:26.000000
House Democrats sign on to letter urging Trump to recognise Palestinian statehood,2025-08-05 00:13:01.000000
Trump’s demand that India stop buying Russian oil puts Modi in tight spot,2025-08-04 16:49:07.000000
Suspected gunmen go on trial in Moscow over concert hall terror attack,2025-08-04 11:30:52.000000
"India to still buy oil from Russia despite Trump threats, say officials",2025-08-02 12:48:08.000000
Myanmar junta ends state of emergency as it prepares for elections,2025-07-31 07:36:37.000000
‘A joyous day’: India celebrates return of ancient gems linked to the Buddha,2025-07-31 04:00:39.000000
Yvette Cooper says ‘crammed’ small boats using shallow water launches behind rise in arrival numbers – UK politics live,2025-08-05 10:04:46.000000
Jeremy Corbyn warns new rules on council asset sales threaten allotments,2025-08-05 09:50:16.000000
Trump attacks ‘seriously woke’ Jaguar Land Rover as company names new CEO,2025-08-05 08:42:07.000000
"Guidance on police disclosing suspects’ ethnicity should change, Cooper says",2025-08-05 08:36:56.000000
TV presenter Jay Blades charged with two counts of rape,2025-08-05 08:25:43.000000
Spirit Airlines pilot ‘removed from duty’ after being arrested on stalking charges,2025-08-05 10:00:54.000000
Texas redistricting standoff escalates with threat to arrest absent Democrats – US politics live,2025-08-05 09:53:48.000000
"Trump firing of statistics chief puts US data credibility at risk, experts warn",2025-08-05 09:00:54.000000
The one thing Donald Trump isn’t saying about tariffs,2025-08-05 09:00:54.000000
"Central California issues evacuation orders after wildfire burns 72,000 acres",2025-08-05 02:06:25.000000
Brazil’s former President Bolsonaro placed under house arrest,2025-08-05 09:55:10.000000
Tendulkar leads praise for India after Test fightback in England,2025-08-05 09:16:10.000000
Hezbollah supporters protest disarmament ahead of Lebanese government talks,2025-08-05 09:02:58.000000
Who’s seeking asylum in Europe today?,2025-08-05 08:51:38.000000
Bengaluru stops salaries as India’s Super League turmoil deepens,2025-08-05 08:37:41.000000
"80 years after Hiroshima atomic bombing, search for missing continues",2025-08-05 08:32:00.000000
Japan logs two new highest temperatures on record in a day,2025-08-05 07:45:03.000000
"Hong Kong cancels passports, bans financial support for wanted activists",2025-08-05 05:30:17.000000
"Australia, Japan strike largest defence deal for advanced warships",2025-08-05 05:25:45.000000
"Israel’s Netanyahu has decided on full occupation of Gaza, reports say",2025-08-05 03:14:46.000000
Australia’s FM warns of ‘risk there will be no Palestine left to recognise’,2025-08-05 03:05:58.000000
Bangladesh teeters between hope and deadlock a year after Hasina’s fall,2025-08-05 02:31:32.000000
Russia’s Medvedev issues warning as Moscow says not bound by missile treaty,2025-08-05 01:52:08.000000
"Russia-Ukraine war: List of key events, day 1,258",2025-08-05 00:15:19.000000
Far-right figure Tommy Robinson arrested for train station assault in UK,2025-08-04 23:14:24.000000
US Democrats flee Texas to block Trump-backed election redistricting,2025-08-04 22:47:37.000000
"Milei vetoes pension, disability spending increases as Argentina feels cuts",2025-08-04 22:03:44.000000
Palestinians distraught over relatives missing at deadly Gaza aid sites,2025-08-04 21:26:45.000000
Brazil Supreme Court orders house arrest of former President Bolsonaro,2025-08-04 21:24:33.000000
Demands for justice on fifth anniversary of deadly Beirut port blast,2025-08-04 20:49:50.000000
US House Speaker Mike Johnson visits Israeli West Bank settlement,2025-08-04 20:26:59.000000
Commuters flee New Jersey train after fire breaks out,2025-08-04 19:26:03.000000
Why have relations between Trump and Modi nosedived so quickly?,2025-08-04 19:15:27.000000
Israel court halts gov’t firing of attorney general investigating Netanyahu,2025-08-04 18:57:39.000000
"Syria’s Kurdish-led SDF, government forces clash in Aleppo province",2025-08-04 18:51:29.000000
This Tuscan startup sold all its olive oil in the U.S. Then came Trump's tariffs,2025-08-05 09:05:00.000000
Trump puts pressure on Putin moving nuclear submarines closer to Russia,2025-08-05 08:08:06.000000
"As ceasefire talks stall, Israel's government weighs a full occupation of Gaza",2025-08-05 08:05:58.000000
A retired Israeli Major General on why he signed a letter to President Trump,2025-08-05 08:05:29.000000
India reacts as Trump promises to raise tariffs for buying Russian oil,2025-08-05 08:04:56.000000
Brazil's Supreme Court orders house arrest for former President Bolsonaro,2025-08-05 04:49:11.000000
"State Department may require some visa applicants to post bond of up to $15,000",2025-08-05 03:55:27.000000
The Global Impact of the Latest U.S. Tariffs,2025-08-04 20:49:02.000000
Videos of emaciated hostages in Gaza raise pressure on Israel for a ceasefire,2025-08-04 13:57:55.000000
From allies to enemies: How the 1979 revolution transformed U.S.-Iranian relations,2025-08-04 13:47:44.000000
The War Room newsletter: How receiving aid became fatal in Gaza,2025-08-04 17:43:16.000000
Could AI tilt the outcome of elections?,2025-07-31 13:02:38.000000
How spy agencies are experimenting with the newest AI models,2025-07-29 17:20:50.000000
Can China save South Africa from Donald Trump?,2025-07-29 11:17:10.000000
Look inside The Economist’s summer issue for 2025,2025-07-28 17:24:58.000000
The world court joins the fight over climate change,2025-07-24 14:44:29.000000
Rethinking the war on AIDS,2025-07-24 12:59:53.000000
The surprising lessons of a secret cold-war nuclear programme,2025-07-22 20:51:43.000000
The War Room newsletter: Three new books on espionage,2025-07-21 16:23:54.000000
The rise and rise of women’s sport,2025-07-17 12:48:23.000000
Cynical realism won’t save India from Donald Trump,2025-07-15 20:16:10.000000
"Gianni Infantino, FIFA’s strongman-loving boss",2025-07-11 17:35:14.000000
Putin’s war in Ukraine may cost him control of the south Caucasus,2025-07-10 12:54:40.000000
The 19th century is a terrible guide to modern statecraft,2025-07-08 19:09:01.000000
Putin’s radioactive chokehold on the world,2025-07-03 12:58:43.000000
How South Africa could harness Donald Trump’s wrath,2025-07-01 21:07:03.000000
The War Room newsletter: The daddy of all summits,2025-06-30 17:12:18.000000
Sex work in the gig economy,2025-06-26 12:43:33.000000
Feckless Europe accepts Trump’s Lone Ranger diplomacy,2025-06-24 17:37:41.000000
Can men and women be just friends?,2025-06-19 12:57:40.000000
"In Trumpworld, toppling rulers is taboo",2025-06-17 12:26:17.000000
The War Room newsletter: Why Israel attacked Iran—and what comes next,2025-06-13 15:41:07.000000
The West has stopped losing its religion,2025-06-12 13:00:23.000000
Taiwan thinks the unthinkable: resisting China without America,2025-06-10 19:08:48.000000
The War Room newsletter: Britain’s defence goals are admirably absurd,2025-06-09 16:10:34.000000
"To earn American help, allies are told to elect nationalists",2025-06-03 21:00:16.000000
Vladimir Putin’s sickening statistic: 1m Russian casualties in Ukraine,2025-06-02 18:51:16.000000
The War Room newsletter: How Ukraine humbled Putin (again),2025-06-02 15:16:10.000000
The Uber of the underworld,2025-05-29 12:48:24.000000
The War Room newsletter: Explore our “Archive 1945” project,2025-05-29 09:04:06.000000
Donald Trump steals Xi Jinping’s favourite foreign policy,2025-05-27 18:33:51.000000
Can China jam your GPS?,2025-05-22 12:47:13.000000
Star wars returns,2025-05-21 17:55:03.000000
"How to fight the next pandemic, without America",2025-05-20 19:34:44.000000
The War Room newsletter: Shadow games in the Baltic,2025-05-19 15:52:08.000000
Fact-checkers forecast which dodgy claims will do most damage,2025-05-15 12:59:07.000000
China and Russia are deploying powerful new weapons: ideas,2025-05-15 11:15:12.000000
Why Donald Trump is a globalist,2025-05-13 18:50:52.000000
The War Room newsletter: Six must-read books on the second world war,2025-05-05 16:14:31.000000
The UN could run out of cash within months,2025-05-01 12:59:11.000000
Donald Trump picks the wrong trade fight with China,2025-04-29 21:07:45.000000
A Trump executive order will unleash a global deep-sea mining boom,2025-04-25 17:51:49.000000
Why some countries are once again embracing cluster bombs,2025-04-24 12:49:36.000000
The ugly task of Putin-proofing your border,2025-04-22 18:00:09.000000
Trump’s red-hot war on terror,2025-04-22 16:46:04.000000
The coming struggle to choose the next pope,2025-04-21 12:56:17.000000
Plastics are greener than they seem,2025-04-16 13:20:45.000000
Xi Jinping’s Trump-sized puzzle,2025-04-15 18:01:52.000000
"The War Room newsletter: Is American diplomacy all bark, no bite?",2025-04-14 16:07:10.000000
There is a vast hidden workforce behind AI,2025-04-10 09:54:26.000000
Bolsonaro Takes Stand in Coup Trial,2025-06-13 23:31:37.000000
Analysis: NYT’s bizarre coverage and omissions of Bolsonaro’s murderous coup plot,2024-12-11 11:57:00.000000
Nathália Urban Presente!,2024-09-27 20:45:59.000000
Inside Brazil’s X Ban: How Elon Musk Started–and lost–a Fight With Brazil’s Judiciary,2024-09-05 21:54:18.000000
"Minister warns of “industrial-scale” organized disinformation campaign, hindering disaster efforts",2024-05-15 13:41:27.000000
Local Government’s responsibility for Porto Alegre flood catastrophe,2024-05-12 13:09:26.000000
US Congresswoman Takes Down Fantasist Republican Committee Hearing on Brazilian Democracy,2024-05-09 12:19:14.000000
Greenwald accused of thinking he is “civilizing the natives”,2024-04-23 14:29:08.000000
Brazilian lawyer exposes deceit at heart of “Twitter Files”,2024-04-18 12:17:20.000000
Elon Musk Leads Far Right Propaganda Blitz On Brazil’s Democracy,2024-04-10 20:50:54.000000
"The New Game in Brazilian Football: Big Money, Bold Moves, and Changing the Rules",2025-08-05 10:18:50.000000
"State Ownership Versus Market Forces: What’s Next for Cemig, Copasa, and RD Saúde?",2025-08-05 09:53:38.000000
"Brazil’s Housing Prices Jump as Monthly Growth Hits 0.58% in July, Outpacing Inflation",2025-08-05 09:08:30.000000
Brazil Stands Firm: COP30 Will Stay in Belém Despite Rising Costs and Global Pressure,2025-08-05 09:04:36.000000
Brazil’s Prio and Brava Energia Push Oil Limits Amid Technical and Market Challenges,2025-08-05 08:59:39.000000
Bolsonaro House Arrest Aims to Display Moraes’ Defiance to U.S. Sanctions but Risks Deepening U.S.–Brazil Rift,2025-08-05 08:58:57.000000
"Chilean Peso Holds Ground, Santiago Stocks Steady—Copper Policy Calms Markets While Top Shares Diverge",2025-08-05 08:06:13.000000
"Brazil’s Financial Morning Call for August 5, 2025",2025-08-05 08:01:27.000000
Tense Peso Gains and Select Stocks Lead Buenos Aires Markets Amid Volatility,2025-08-05 07:49:22.000000
"Peso Slides, Stocks Lose Support as Mexico’s Troubles Deepen: Standout Gainers and Losers",2025-08-05 07:37:59.000000
Netherlands to buy US arms for Ukraine under new NATO scheme,2025-08-05 10:20:17.272256
Fact check: Are X's community notes fixing or fueling misinformation?,2025-08-05 10:20:17.272264
Can a global treaty solve the plastics crisis?,2025-08-05 10:20:17.272267
Denmark zoo asks people to donate pets to feed predators,2025-08-05 10:20:17.272270
Germany updates: AfD ex-aide on trial for China espionage,2025-08-05 10:20:17.272274
Middle East: Netanyahu to 'update' Gaza war plan,2025-08-05 10:20:17.272277
Heroes and villians: 30 years since the Croatian War of Independence,2025-08-05 10:20:17.272280
"US to require bonds of up to $15,000 for some tourists",2025-08-05 10:20:17.272283
Australia to buy 11 advanced warships from Japan,2025-08-05 10:20:17.272287
Brazil's top court orders house arrest for Bolsonaro,2025-08-05 10:20:17.272290
India brushes off Trump tariff threat over Russian oil,2025-08-05 10:20:17.272293
Middle East: Hostage families criticize reported Israeli war plans,2025-08-05 10:20:17.272296
Tesla awards Musk $29 billion in bid to keep him as CEO,2025-08-05 10:20:17.272299
Germany updates: Finance minister in US amid tariff tension,2025-08-05 10:20:17.272302
Texas governor issues threat as Democrats leave in protest,2025-08-05 10:20:17.272306
Germany: Baboons fed to lions and tigers after zoo culling,2025-08-05 10:20:17.272309
"Over 10,000 hotels join complaint against Booking.com",2025-08-05 10:20:17.272312
Russia warns against 'nuclear rhetoric' amid Trump row,2025-08-05 10:20:17.272315
Germany to raise 'mothers' pension' — despite cash-strapped public coffers,2025-08-05 10:20:17.272318
Sri Lanka: Farmers fight solar plans on ancestral lands,2025-08-05 10:20:17.272321
Scientists search for climate clues in ancient ice,2025-08-05 10:20:17.272325
Why the birth rate in Germany continues to nosedive,2025-08-05 10:20:17.272327
German police expands use of Palantir surveillance software,2025-08-05 10:20:17.272330
Pope's 'Jubilee of Youth' ends with mass for 1 million,2025-08-05 10:20:17.272333
Political ploy? Czech Republic outlaws communist propaganda,2025-08-05 10:20:17.272337
Germany updates: Welfare payments up by €4 billion last year,2025-08-05 10:20:17.272340
Long-distance weapons: German money for Ukraine's combat drones,2025-08-05 10:20:17.272343
German nursing homes see cost for care explode,2025-08-05 10:20:17.272347
Romania ready to talk about Sinti and Roma genocide,2025-08-05 10:20:17.272350
German government takes tougher tone with Israel,2025-08-05 10:20:17.272353
Tottenham Hotspur captain Son to leave club after a decade,2025-08-05 10:20:17.272356
Will Germany raise retirement age beyond 67?,2025-08-05 10:20:17.272359
Recognizing Palestine would deepen French Muslim-Jewish rift,2025-08-05 10:20:17.272362
Detroit's Pewabic Pottery takes a road less traveled,2025-08-05 10:20:17.272365
Hans Christian Andersen's timeless legacy,2025-08-05 10:20:17.272368
Why Qatar's gas lifeline to Germany is at risk,2025-08-05 10:20:17.272371
How climate change is changing mountaineering,2025-08-05 10:20:17.272374
Stasi: How the GDR kept its citizens under surveillance,2025-08-05 10:20:17.272377
Germany: Second arson attack on rail line in two days,2025-08-05 10:20:17.272380
Trump tariffs: Where do we stand after White House unveils slew of new tariffs,2025-08-05 10:20:17.272383
What's behind UK foreign policy change on Palestinian state?,2025-08-05 10:20:17.272387
Trump's EPA to roll back cornerstone of climate action,2025-08-05 10:20:17.272390
Fake medication is a problem across the world,2025-08-05 10:20:17.272393
Germany updates: Sabotage suspected in major rail disruption,2025-08-05 10:20:17.272396
Berlin-Hamburg: Deutsche Bahn closes Germany's top route,2025-08-05 10:20:17.272399
Swedish jihadi jailed for life over infamous murder of pilot,2025-08-05 10:20:17.272402
German development aid: New spending cuts ahead,2025-08-05 10:20:17.272405
Will Australia's youth social media ban work?,2025-08-05 10:20:17.272408
US-EU trade deal could lock bloc into fossil fuel dependency,2025-08-05 10:20:17.272411
Learning to live with earthquakes: Lessons from around the world,2025-08-05 10:20:17.272414
United Nations High-Level International Conference - New York Declaration on the Peaceful Settlement of the Question of Palestine and the Implementation of the Two-State solution (29 July 2025),2025-08-04 12:52:53.000000
Situation of Mme Nour Attaalah (3 August 2025),2025-08-04 12:12:57.000000
Israel/Palestinian Territories: Broadcasting of videos of Israeli hostages held by Hamas (2 August 2025),2025-08-04 12:11:47.000000
Joint Statement – Iranian State Threatss (31.07.25),2025-07-31 17:59:38.000000
Ukraine – Condemnation of massive Russian airstrikes targeting Ukrainian cities (31.07.25),2025-07-31 16:07:43.000000
Anna Politkovskaya-Arman Soldin Prize for Courage in Journalism – Call for applications,2025-07-31 09:54:22.000000
"UN – Two-State Solution Conference – Meeting between Minister for Europe and Foreign Affairs Jean-Noël Barrot and UN Secretary-General António Guterres (July 30, 2025)",2025-07-30 17:00:11.000000
Israel / Palestinian Territories : Joint statement of the Ministers of Foreign Affairs - New York Call (29.07.25),2025-07-30 00:21:27.000000
30th session of the International Seabed Authority (ISA) Assembly and Council (25.07.25),2025-07-29 17:04:58.000000
"Israel/Palestinian Territories – Murder of Odeh Hathalin in the West Bank (July 29, 2025)",2025-07-29 16:53:29.000000
'Sinwar killed peace': Grandson of Israeli hostages urges 'to work back towards path' to peace,2025-08-05 09:54:40.000000
Brazil's Supreme Court orders house arrest for former President Bolsonaro,2025-08-05 09:32:18.000000
Israeli PM Netanyahu seeks to expand Gaza operations,2025-08-05 09:30:13.000000
Making sport accessible in South Africa: Former SA coach builds cricket facilities for children,2025-08-05 09:26:59.000000
Fans gather in Poland for International piano festival,2025-08-05 09:21:30.000000
Eurostar still faces delays as high-speed train travel resumes in northern France,2025-08-05 09:14:04.000000
"UK to begin migrant returns to France under 'one in, one out' deal",2025-08-05 08:45:53.000000
Trump threatens India with high tariffs over Russian oil,2025-08-05 08:42:19.000000
Brazil judge places former president Bolsonaro under house arrest,2025-08-05 08:39:32.000000
Trump envoy to visit Moscow before deadline for ending Ukraine war,2025-08-05 08:35:11.000000
Serious mood and fewer perks: Silicon Valley enters its 'hard tech' era,2025-08-05 08:28:47.000000
Israel to partially reopen Gaza private sector trade as Netanyahu prepares updated war plan,2025-08-05 08:20:21.000000
Texas governor vows to arrest absent Democrats blocking redistricting vote,2025-08-05 06:55:33.000000
"Amid desperation in war-torn Gaza, 'environment of fear, intimidation and worry in West Bank'",2025-08-05 06:54:41.000000
Live: Israel to partially reopen Gaza private sector trade as Netanyahu prepares updated war plan,2025-08-05 06:29:49.000000
"The Bright Side: Gabon's ancient caves shed light on 27,000 years of human history",2025-08-05 06:21:21.000000
Trump's DOJ to open grand jury probe into Obama officials over 'Russiagate',2025-08-05 05:41:45.000000
"Hato new Chelsea's signing, Fritz made history in Toronto",2025-08-05 05:14:05.000000
A 'plastic-free future'? UN plastic pollution talks kick off in Geneva,2025-08-05 02:53:10.000000
Brazil judge places former president Bolsonaro under house arrest,2025-08-04 23:05:15.000000
Dozens dead after migrant boat sinks off Yemen coast,2025-08-04 21:02:53.000000
"‘Sami rights are at risk’: Reindeer herders, environmentalists oppose mine in Norway's Arctic",2025-08-04 20:25:58.000000
Hong Kong deploys 3 robotic ‘water-pumping dragons’ to drain 24 floods,2025-08-05 10:18:25.000000
PLA showcases amphibious attacks on Taiwan in latest episode of documentary,2025-08-05 10:00:18.000000
"Alibaba, ByteDance kick off campus recruitment campaigns as AI drives growth",2025-08-05 10:00:15.000000
China scammers con man by posing as 1 woman using voice changers; victim calls police,2025-08-05 10:00:11.000000
Chinese tourists stranded while rafting in valley,2025-08-05 09:15:13.000000
Revealed: the Li family home of 6 decades and focus of social media hoax,2025-08-05 09:00:17.000000
"Alibaba, Beijing United Family Hospital partner to use AI in cancer diagnosis",2025-08-05 09:00:07.000000
"China’s high-speed rail nears 50,000km milestone – but is it sustainable?",2025-08-05 09:00:03.000000
