title,date
"China needs smarter, not less, investment to unlock household demand",2025-08-05 08:30:08.000000
Beijing ‘on high alert’ for disruption after Philippine-India navy patrol: PLA,2025-08-05 08:10:50.000000
Philippines rejects Chinese ‘fake news’ broadcast of South China Sea clash,2025-08-05 08:00:13.000000
Elderly man arrested in Hong Kong for allegedly assaulting bus driver,2025-08-05 07:46:42.000000
Malaysian influencers’ chicken bones prank on homeless man sparks police probe,2025-08-05 07:45:52.000000
Chinese city orders real-name registration for chikungunya fever medication,2025-08-05 07:28:36.000000
Malaysia’s US tariff deal comes with a US$240 billion price tag,2025-08-05 06:44:27.000000
France’s struggling factories need investment. Is China the answer?,2025-08-05 06:00:14.000000
"China university plans nation’s first BBQ research centre to train 1,000 ‘craftsmen’",2025-08-05 06:00:09.000000
A&E services at Hong Kong’s Queen Mary Hospital resume after Pok Fu Lam flooded,2025-08-05 05:10:25.000000
Hong Kong downgrades second-longest black rainstorm signal on record to amber – as it happened,2025-08-05 05:07:02.000000
"East Asia’s record heat, Singapore F1 tycoon admits guilt: 7 Asia highlights",2025-08-05 04:15:09.000000
"What do we know about China’s most advanced early warning plane, the KL-3000?",2025-08-05 04:00:08.000000
Hong Kong police on the hunt for man who used fake bills to buy luxury watches,2025-08-05 03:55:09.000000
‘Deeply regressive’: sanitary pad protest stirs outrage in Malaysia,2025-08-05 03:33:39.000000
"Hong Kong police investigate headless, dismembered body found in Mid-Levels",2025-08-05 03:17:09.000000
"China wants people to eat more high-quality beef, unveils quality-grading system",2025-08-05 03:00:09.000000
Will Hong Kong firms feel US tariff pinch? Trade council head cautious but upbeat,2025-08-05 01:30:12.000000
"Taiwan could run out of energy in 10 days under PLA blockade, report warns",2025-08-05 01:00:16.000000
"‘I can swim’: China husband tells flood rescuers to save wife first, touches hearts",2025-08-05 01:00:08.000000
Black rainstorm warning to stay in force in Hong Kong until 5pm,2025-08-05 00:44:44.000000
Wellcome supermarket is on a drive to win Hongkongers back from Shenzhen,2025-08-05 00:30:07.000000
‘Sentimental words’: why North Korea dismisses South’s removing of loudspeakers,2025-08-05 00:00:07.000000
Hong Kong trade promoter to form ‘strategic alliance’ with Bank of China,2025-08-04 23:30:08.000000
China’s Hainan eyes medical tourism boom after South Korea scraps tax perks,2025-08-04 23:00:16.000000
‘Too far ahead’: can the US upskill to compete with China on rare earths?,2025-08-04 22:00:08.000000
China opens door to Brazilian coffee as US slaps on new tariff,2025-08-04 21:52:16.000000
‘Hong Kong taxis to be barred from High Island Reservoir hotspot at peak times’,2025-08-04 15:37:58.000000
"Hong Kong employers’ group urges domestic helper wage freeze, cites poor economy",2025-08-04 14:26:55.000000
Is Singapore’s parliament tame? WP’s Pritam Singh says it’s just ‘pragmatic’,2025-08-04 14:07:40.000000
China’s air force looks to ‘kill chain’ to help older jets down newer models,2025-08-04 14:00:10.000000
Another storm brews for CK Hutchison under Panama ports partnership proposal,2025-08-04 13:51:01.000000
‘Western hegemony is over’; lessons from Ukraine war: SCMP daily highlights,2025-08-04 13:15:07.000000
Alibaba’s maps app gets an AI upgrade with Qwen-powered agent,2025-08-04 13:00:15.000000
Baidu partners with Lyft to launch robotaxis in UK and Germany,2025-08-04 12:00:13.000000
Top-tier mathematician Li Hanfeng leaves US for China’s Chongqing University,2025-08-04 12:00:09.000000
CLP Holdings sees growth in Tuen Mun industrial park as first-half profit falls,2025-08-04 12:00:06.000000
Hong Kong records 56% more monthly rainfall in July thanks to Typhoon Wipha,2025-08-04 11:48:03.000000
Hong Kong’s residential property transactions fall in July from June,2025-08-04 11:15:10.000000
Taiwan and mainland China coastguards engage in close Dongsha Island encounter,2025-08-04 11:00:13.000000
Beijing’s E-Town offers subsidies to robot buyers as China embraces humanoids,2025-08-04 11:00:09.000000
"Li mansion in Deep Water Bay is ‘not for sale’, CK Asset says in rebuke",2025-08-04 10:38:10.000000
"More extreme weather expected due to climate change, ex-Observatory official says after week’s 4th black rain signal",2025-08-05 10:10:32.000000
Far-right German lawmaker’s ex-aide on trial for spying for China,2025-08-05 08:51:43.000000
Hong Kong gov’t to look into inaccurate flag design used at rope-skipping competition in Japan,2025-08-05 07:43:27.000000
Hong Kong company barred from hiring non-local labour after rejecting local applicants,2025-08-05 06:12:56.000000
Widespread flooding hits Hong Kong as Observatory issues 4th black rainstorm warning in a week,2025-08-05 04:52:08.000000
"Man found guilty of desecrating Chinese, Hong Kong flags seeks to overturn conviction at city’s apex court",2025-08-04 23:30:00.000000
Beijing issues new storm warning after deadly floods,2025-08-04 11:18:08.000000
Fans of K-pop star G-Dragon scammed out of HK$610k in fake tickets for Hong Kong concerts,2025-08-04 09:47:01.000000
Australian police charge Chinese national with ‘foreign interference’ over alleged spying for Beijing,2025-08-04 08:28:33.000000
"‘We are workers, we are not slaves’: Hong Kong migrant domestic workers protest for ‘living wage’",2025-08-04 08:10:46.000000
Hong Kong cancels passports of 12 activists wanted under nat. sec law after involvement with overseas group,2025-08-04 06:29:41.000000
"Hong Kong may see surplus in current financial year, defying previous forecasts of continuing deficit",2025-08-04 05:15:40.000000
Hong Kong records first imported case of chikungunya fever after outbreak in mainland China,2025-08-03 23:30:00.000000
China and Russia start joint drills in Sea of Japan,2025-08-03 12:33:01.000000
EU condemns arrest of former Macau pro-democracy lawmaker,2025-08-03 03:22:10.000000
Fruit and vegetables now defy the seasons – with one exception: the lychee,2025-08-03 01:00:00.000000
"Explainer: Hong Kong same-sex partners bill – LGBTQ activists’ reactions, lawmakers’ debates, and what’s next",2025-08-03 00:00:00.000000
11 new arrests over fatal Serbian train station disaster involving 2 Chinese companies,2025-08-02 07:00:00.000000
‘We are not idealists’: Hong Kong activists face tough compromise over LGBTQ rights blueprint,2025-08-02 02:00:00.000000
"HKFP Monitor August 2, 2025: Advocacy space shrinks as LGBTQ event axed, academia falls in line",2025-08-02 01:00:00.000000
"Attacker wounds Japanese national in China with rock, Tokyo embassy says",2025-08-01 12:41:06.000000
Hong Kong man arrested for allegedly threatening media outlets to publish ‘seditious’ report,2025-08-01 11:55:07.000000
UK to ‘never allow’ political extradition of Hongkongers after alarm over law changes,2025-08-01 11:33:20.000000
"Nvidia says no ‘backdoors’ in chips allowing remote access, as China questions security",2025-08-01 10:22:46.000000
"Hong Kong harbour protection group disbands after 30 years, citing reclamation law changes",2025-08-01 09:37:49.000000
Taiwan vows to seek lower tariff after Trump’s ‘temporary’ 20% levy,2025-08-01 07:25:53.000000
"Chikungunya fever poses ‘medium to high risk’ of local transmission, warns Hong Kong health official",2025-08-01 06:21:58.000000
"Gov’t-supported youth climate scheme accepting funds from ExxonMobil, world’s 5th largest historic polluter",2025-08-01 06:20:20.000000
"Unsolicited free delivery of state-run China Daily copies to UK Parliament halted after review, says MP",2025-08-01 05:06:37.000000
Transport Department appeals against ruling that overturned refusal of hire car permits to prospective Uber drivers,2025-08-01 04:33:04.000000
La Xiqueñada: A first-timer’s guide to Xico’s raucous weeks-long festival,2025-08-05 08:36:07.000000
Sheinbaum pushes back on claims of strained US security relations: Monday’s mañanera recapped,2025-08-05 00:58:00.000000
"After another round of successful negotiations, what is Mexico doing to achieve permanent tariff relief?",2025-08-05 00:36:26.000000
Shakira has sold a record-breaking 1 million tickets in Mexico,2025-08-04 23:53:39.000000
Mexico asks US to extradite former daycare owner convicted of manslaughter,2025-08-04 22:16:16.000000
Baja California Sur becomes first state to legalize swimming with orcas,2025-08-04 21:08:09.000000
"The fun, friendly and frugal way to travel within (and outside) Mexico",2025-08-04 20:43:22.000000
What to cook this August,2025-08-04 19:43:31.000000
Sailboat carrying US $381M in drugs from Mexico intercepted in French Polynesia,2025-08-04 18:38:46.000000
"Remittances to Mexico plummet 16.2% in June, the biggest drop in over a decade",2025-08-04 18:19:10.000000
‘People are scared to go out’: fear of Ice agents forces cancellation of US summer festivals,2025-08-04 11:12:48.000000
Ten lessons the Aztecs can teach us today |  Sebastian Purcell,2025-08-04 10:00:03.000000
Trump imposes sweeping new tariffs on dozens of countries in latest bid to reshape global trade,2025-08-01 01:37:26.000000
Sheinbaum demands return of Mexican citizens held at ‘Alligator Alcatraz’,2025-07-30 18:20:59.000000
Tariffs and judicial chaos shake investor confidence in Mexico: ‘Everything has been put on hold’,2025-07-30 11:00:01.000000
It is a potentially lethal chemical – but even Mexico’s cartels can’t resist the lure of mercury,2025-07-24 17:00:33.000000
"Advocates demand closure of ‘Alligator Alcatraz’, citing appalling conditions",2025-07-22 21:04:11.000000
Is it safe to use magic mushrooms while pregnant? One woman’s quest raises questions,2025-07-16 10:00:45.000000
Backlash against Mexico City gentrification echoes global anger at overtourism and rising rents,2025-07-15 12:00:33.000000
"Farm worker who died after California Ice raid was ‘hardworking and innocent’, family says",2025-07-14 20:16:52.000000
"Trump’s latest tariffs ‘are real’ unless deals improve, economic adviser says",2025-07-13 16:13:23.000000
Donald Trump announces 30% tariffs on goods from the EU and Mexico,2025-07-12 14:56:04.000000
South Sudan says eight deportees from the US are under government care,2025-07-09 13:57:36.000000
Why has Latin American shifted to the right? | Ernesto Samper Pizano,2025-07-09 11:00:50.000000
Firefighters from Mexico aid Texas flood search and rescue: ‘There are no borders’,2025-07-08 20:20:04.000000
"Boxer Julio César Chávez Jr was a cartel henchman, Mexican prosecutors claim",2025-07-07 10:00:06.000000
DoJ to give up audio tapes of killing and torture of DEA agent Kiki Camarena,2025-07-06 13:31:36.000000
‘A win for humanity’: Trump’s asylum ban at US-Mexico border ruled unlawful,2025-07-02 20:42:42.000000
US to breed billions of flies and dump them out of aircraft in bid to fight flesh-eating maggot,2025-07-02 17:05:39.000000
Twenty bodies discovered in Sinaloa as Mexican cartel violence surges,2025-06-30 19:19:15.000000
Russia Ends Voluntary Ban on Intermediate-Range Missile Deployments,2025-08-05 08:41:54.000000
Russian Railways Furloughs Staff Amid Freight Traffic Slump – RBC,2025-08-04 15:26:47.000000
'He Played a Colossal Role': Moscow Times Alumni Share Memories of Derk Sauer,2025-08-04 14:49:00.000000
Vologda Governor Escalates Fight With Liquor Store Giant Krasnoe & Beloe,2025-08-04 14:36:22.000000
Young Woman Fined for Filming Oil Depot Fire After Ukrainian Drone Attack,2025-08-04 13:28:20.000000
Trial Begins in Moscow Over Crocus Concert Hall Attack,2025-08-04 12:40:19.000000
Kremlin Calls for Restraint After Trump Deploys Nuclear Submarines,2025-08-04 10:37:00.000000
"Sakhalin Becomes First Russian Region to Reach Carbon Neutrality, Officials Say",2025-08-04 10:11:00.000000
"Train Slams Into Tourist Bus Near St. Petersburg, Killing 1 and Injuring 16",2025-08-04 09:00:51.000000
Russian Police Fatally Shoot 3 Men Suspected of Planning Attacks in Kabardino-Balkaria,2025-08-04 08:34:01.000000
Trump Says Special Envoy Witkoff to Visit Russia in Coming Days,2025-08-04 07:42:00.000000
Ukrainian Drones Spark Fire at Sochi Oil Depot,2025-08-03 09:25:00.000000
China and Russia Start Joint Drills in Sea of Japan,2025-08-03 09:03:39.000000
Dormant Volcano in Russia Erupts for First Time in 450 Years,2025-08-03 08:14:00.000000
"Who Is Dmitry Medvedev, Russia's Hawkish Ex-President?",2025-08-02 15:02:49.000000
"Ukrainian Drone Strikes Kill 3 in Russia's Penza, Samara, Rostov Regions",2025-08-02 09:17:10.000000
Trump Deploys Nuclear Submarines in Row With Russia,2025-08-01 17:35:00.000000
Russian Oil Tankers Idle Off India as Sanctions and U.S. Tariff Threats Disrupt Trade,2025-08-01 16:23:26.000000
Chechnya’s Kadyrov Shares ‘Training’ Video After Reports of Near-Drowning in Turkey,2025-08-01 15:46:21.000000
Suspected Russian Drone Found at Military Training Site in Lithuania,2025-08-01 15:22:41.000000
"Putin Praises Troop Advances, Says Russia Ramping Up Missile Output Despite Trump’s Peace Demand",2025-08-01 14:39:00.000000
"‘The Godfather of the Media Business’: Russian Journalists Remember Derk Sauer, Pioneering Media Entrepreneur",2025-08-01 14:13:00.000000
Russia Limits Access to Key Economic and Demographic Data Amid Downturn Concerns,2025-08-01 12:24:00.000000
Hackers Claim to Publish Aeroflot CEO’s Flight History After Cyberattack,2025-08-01 12:12:07.000000
Azerbaijan Threatens Russian State Media Over Use of Karabakh Capital’s Armenian Name,2025-08-01 10:24:40.000000
Former VK Chief Takes Over Russian Gaming Studio Behind World of Tanks,2025-08-01 10:00:24.000000
Putin Signs Law Allowing Police to Freeze Bank Accounts Without Court Orders,2025-08-01 09:34:47.000000
Kyiv Observes Day of Mourning After Russian Attack Kills 31 People,2025-08-01 09:31:47.000000
"Mudslide Triggers Evacuations, Cuts Water Supply Near Mount Elbrus",2025-08-01 09:16:50.000000
"‘It’s Disgusting’: Trump Condemns Deadly Russian Attack on Kyiv, Threatens Fresh Sanctions",2025-08-01 08:20:00.000000
Russia and U.S. Agree to Extend International Space Station Operations to 2028,2025-08-01 07:46:00.000000
"Derk Sauer, Moscow Times Founder and Dutch Media Entrepreneur, Dies at 72",2025-07-31 15:21:00.000000
Putin Signs Law Criminalizing Searches for ‘Extremist’ Content,2025-07-31 14:37:16.000000
Gorky Moscow Art Theater Director Charged With Bribery – Fontanka,2025-07-31 13:57:00.000000
Russia and Syria Signal Closer Ties Amid Uncertainty Over Military Bases,2025-07-31 12:30:05.000000
Russia Declares Navalny Memoir ‘Extremist’,2025-07-31 11:54:00.000000
Russian-Israeli Writer’s Tashkent Event Canceled After She Says Israel Has Right to Turn Gaza ‘Into a Parking Lot’,2025-07-31 11:25:00.000000
Russian Billionaire Faces $50M Environmental Lawsuit Over Mining Disaster,2025-07-31 10:46:51.000000
"Dozens of Aftershocks Rattle Kamchatka, Volcano Erupts After Powerful Earthquake",2025-07-31 10:12:41.000000
In Photos: Deadly Russian Strikes on Kyiv Kill 31,2025-07-31 08:52:00.000000
Trump and Medvedev Trade Jabs as U.S.-India Trade Talks Stall,2025-07-31 08:42:33.000000
At Least 8 Killed in Russian Strikes on Kyiv as Moscow Claims Capture of Chasiv Yar,2025-07-31 07:42:00.000000
"In Russia, Soldiers’ Wives Are Urged to Give Birth to Children Who Might Never Meet Their Fathers",2025-07-30 17:03:00.000000
‘God Help Me’: Kamchatka Residents Recount Massive 8.8 Magnitude Earthquake,2025-07-30 14:52:57.000000
EU Lawmakers Walk Out During Matviyenko’s Address in Geneva,2025-07-30 14:33:00.000000
"Russians Should Get Ready for More Internet Blackouts and Switch to Cash, Lawmaker Says",2025-07-30 13:54:00.000000
Moldova’s President Accuses Russia of Planning ‘Unprecedented’ Election Interference Campaign,2025-07-30 13:51:08.000000
Russia Bans Imports of Chinese Trucks Over Alleged Safety Violations,2025-07-30 13:23:08.000000
In Photos: The Aftermath of the Historic Earthquake in Russia's Far East,2025-07-30 12:57:11.000000
Italy Summons Russian Ambassador Over ‘Russophobe’ and ‘Hate Speech’ List,2025-07-30 12:27:49.000000
Palestinians Stream Back to Northern Gaza on Foot,2025-01-27 19:23:00.000000
"Leading China Property Developer Reports Huge loss, in Sign of Widening Real-Estate Woes",2025-01-27 17:32:00.000000
Freed Israeli Hostages Still Had Shrapnel in Their Bodies From Oct. 7 Attack,2025-01-27 17:12:00.000000
Suspected Sabotage of Deep-Sea Cable Triggers First NATO-Led Response,2025-01-27 16:22:00.000000
Rwanda-Backed Rebels Enter Congo's Safe-Haven City,2025-01-27 15:07:00.000000
Cocaine-Funded Gangs Shake Colombia Years After Peace Pact,2025-01-27 12:00:00.000000
"Italy Supports Saudi Arabia Joining Fighter-Jet Program, PM Meloni Says",2025-01-27 10:34:00.000000
Shippers Wary of Red Sea Routes Despite Houthi Pledge to End Targeting,2025-01-27 06:05:00.000000
Kim Jong Un Is Doing Everything He Can to Keep North Korea's Youth in Line,2025-01-27 06:05:00.000000
"Trump Says Colombia Will Accept Deportees, Ending Tariff Standoff",2025-01-27 03:59:00.000000
Jeju Air Crash Probe Focuses On Engine Damage After Bird Strike,2025-01-27 03:53:00.000000
"Germany's Economic Model Is Broken, and No One Has a Plan B",2025-01-27 02:00:00.000000
"Trump Says He Wants to 'Clean Out' Gaza, Send Refugees to Egypt and Jordan",2025-01-26 23:30:00.000000
Hamas Releases Four Female Israeli Soldiers Under Gaza Cease-Fire Deal,2025-01-25 18:45:00.000000
Hamas Took More Than 200 Hostages From Israel. Here's What We Know.,2025-01-25 17:00:00.000000
U.N. and Congolese Troops Struggle to Halt Lightning Rebel Attack,2025-01-25 14:32:00.000000
Who Are the Israeli Hostages Released by Hamas?,2025-01-25 11:57:00.000000
The Latest Gaza Hostages Freed: Women Whose Hamas Warnings Were Ignored,2025-01-25 10:05:00.000000
"Beijing Signals Readiness to Talk to Trump's Team, Even Old Foes",2025-01-25 00:58:00.000000
"Canada Is Becoming a Fentanyl Exporter, and a Target for Trump",2025-01-24 22:56:00.000000
"News24 | Stellenbosch University confirms student died of meningitis, starts contact tracing",2025-08-05 10:22:35.863998
"News24 |  Petrol price relief from Wednesday, but diesel hiked",2025-08-05 10:22:35.864003
"News24 | High Court dismisses Kunene hate speech appeal, gives him a month to apologise to Malema",2025-08-05 10:22:35.864006
"News24 | Former New Zealand top cop Jevon McSkimming charged over child porn, bestiality material",2025-08-05 10:22:35.864008
News24 | Brand Story | Fedhealth launches a bold Medical Aid reboot,2025-08-05 10:22:35.864011
"News24 | Alleged serial rapist, murderer arrested after using dating app to lure women",2025-08-05 10:22:35.864013
News24 | Sponsored | How to be financially healthier and be rewarded,2025-08-05 10:22:35.864015
"News24 | Furious Brazil judge slams Bolsonaro who treated court ‘like a fool’, orders house arrest",2025-08-05 10:22:35.864017
"News24 | Boy, 11, drowns after becoming stuck in muddy excavation pit",2025-08-05 10:22:35.864020
"News24 | Tuesday’s weather: Chilly in Western Cape, Northern Cape, with light snow in Eastern Cape",2025-08-05 10:22:35.864022
"News24 | PODCAST | The Lead: Shades of Babita - another auditor, another hit and more tender billions",2025-08-05 10:22:35.864024
News24 | US warns of heavy gunfire near its embassy in Haiti,2025-08-05 10:22:35.864026
News24 | UK teen jailed for a year for torturing two kittens to death,2025-08-05 10:22:35.864028
News24 | Here are the Daily Lotto numbers,2025-08-05 10:22:35.864030
