title,date,topic,topic_name,period
Heroes and villians: 30 years since the Croatian War of Independence,2025-08-05 10:20:17.272280,7,7_room newsletter_newsletter_war room_room,2025-08-05
"US to require bonds of up to $15,000 for some tourists",2025-08-05 10:20:17.272283,-1,-1_china_ai_news24_new,2025-08-05
Australia to buy 11 advanced warships from Japan,2025-08-05 10:20:17.272287,-1,-1_china_ai_news24_new,2025-08-05
Brazil's top court orders house arrest for Bolsonaro,2025-08-05 10:20:17.272290,5,5_bolsonaro_house arrest_house_arrest,2025-08-05
India brushes off Trump tariff threat over Russian oil,2025-08-05 10:20:17.272293,3,3_tariffs_oil_trump_tariff,2025-08-05
Middle East: Hostage families criticize reported Israeli war plans,2025-08-05 10:20:17.272296,2,2_gaza_israeli_hostages_israel,2025-08-05
Tesla awards Musk $29 billion in bid to keep him as CEO,2025-08-05 10:20:17.272299,5,5_bolsonaro_house arrest_house_arrest,2025-08-05
Germany updates: Finance minister in US amid tariff tension,2025-08-05 10:20:17.272302,8,8_germany_germanys_pension_age,2025-08-05
Texas governor issues threat as Democrats leave in protest,2025-08-05 10:20:17.272306,-1,-1_china_ai_news24_new,2025-08-05
Germany: Baboons fed to lions and tigers after zoo culling,2025-08-05 10:20:17.272309,-1,-1_china_ai_news24_new,2025-08-05
"Over 10,000 hotels join complaint against Booking.com",2025-08-05 10:20:17.272312,-1,-1_china_ai_news24_new,2025-08-05
Russia warns against 'nuclear rhetoric' amid Trump row,2025-08-05 10:20:17.272315,1,1_russia_russian_ukraine_moscow,2025-08-05
Germany to raise 'mothers' pension' — despite cash-strapped public coffers,2025-08-05 10:20:17.272318,8,8_germany_germanys_pension_age,2025-08-05
Sri Lanka: Farmers fight solar plans on ancestral lands,2025-08-05 10:20:17.272321,9,9_summer_festival_ancient_august,2025-08-05
Scientists search for climate clues in ancient ice,2025-08-05 10:20:17.272325,0,0_hong_kong_hong kong_china,2025-08-05
Why the birth rate in Germany continues to nosedive,2025-08-05 10:20:17.272327,8,8_germany_germanys_pension_age,2025-08-05
German police expands use of Palantir surveillance software,2025-08-05 10:20:17.272330,-1,-1_china_ai_news24_new,2025-08-05
Pope's 'Jubilee of Youth' ends with mass for 1 million,2025-08-05 10:20:17.272333,-1,-1_china_ai_news24_new,2025-08-05
Political ploy? Czech Republic outlaws communist propaganda,2025-08-05 10:20:17.272337,1,1_russia_russian_ukraine_moscow,2025-08-05
Germany updates: Welfare payments up by €4 billion last year,2025-08-05 10:20:17.272340,8,8_germany_germanys_pension_age,2025-08-05
Long-distance weapons: German money for Ukraine's combat drones,2025-08-05 10:20:17.272343,1,1_russia_russian_ukraine_moscow,2025-08-05
German nursing homes see cost for care explode,2025-08-05 10:20:17.272347,8,8_germany_germanys_pension_age,2025-08-05
Romania ready to talk about Sinti and Roma genocide,2025-08-05 10:20:17.272350,1,1_russia_russian_ukraine_moscow,2025-08-05
German government takes tougher tone with Israel,2025-08-05 10:20:17.272353,2,2_gaza_israeli_hostages_israel,2025-08-05
Tottenham Hotspur captain Son to leave club after a decade,2025-08-05 10:20:17.272356,-1,-1_china_ai_news24_new,2025-08-05
Will Germany raise retirement age beyond 67?,2025-08-05 10:20:17.272359,8,8_germany_germanys_pension_age,2025-08-05
Recognizing Palestine would deepen French Muslim-Jewish rift,2025-08-05 10:20:17.272362,2,2_gaza_israeli_hostages_israel,2025-08-05
Detroit's Pewabic Pottery takes a road less traveled,2025-08-05 10:20:17.272365,-1,-1_china_ai_news24_new,2025-08-05
Hans Christian Andersen's timeless legacy,2025-08-05 10:20:17.272368,7,7_room newsletter_newsletter_war room_room,2025-08-05
Why Qatar's gas lifeline to Germany is at risk,2025-08-05 10:20:17.272371,8,8_germany_germanys_pension_age,2025-08-05
How climate change is changing mountaineering,2025-08-05 10:20:17.272374,0,0_hong_kong_hong kong_china,2025-08-05
Stasi: How the GDR kept its citizens under surveillance,2025-08-05 10:20:17.272377,-1,-1_china_ai_news24_new,2025-08-05
Germany: Second arson attack on rail line in two days,2025-08-05 10:20:17.272380,-1,-1_china_ai_news24_new,2025-08-05
Trump tariffs: Where do we stand after White House unveils slew of new tariffs,2025-08-05 10:20:17.272383,3,3_tariffs_oil_trump_tariff,2025-08-05
What's behind UK foreign policy change on Palestinian state?,2025-08-05 10:20:17.272387,2,2_gaza_israeli_hostages_israel,2025-08-05
Trump's EPA to roll back cornerstone of climate action,2025-08-05 10:20:17.272390,3,3_tariffs_oil_trump_tariff,2025-08-05
Fake medication is a problem across the world,2025-08-05 10:20:17.272393,-1,-1_china_ai_news24_new,2025-08-05
Germany updates: Sabotage suspected in major rail disruption,2025-08-05 10:20:17.272396,6,6_france_uk_boats_returns france,2025-08-05
Berlin-Hamburg: Deutsche Bahn closes Germany's top route,2025-08-05 10:20:17.272399,8,8_germany_germanys_pension_age,2025-08-05
Swedish jihadi jailed for life over infamous murder of pilot,2025-08-05 10:20:17.272402,2,2_gaza_israeli_hostages_israel,2025-08-05
German development aid: New spending cuts ahead,2025-08-05 10:20:17.272405,8,8_germany_germanys_pension_age,2025-08-05
Will Australia's youth social media ban work?,2025-08-05 10:20:17.272408,-1,-1_china_ai_news24_new,2025-08-05
US-EU trade deal could lock bloc into fossil fuel dependency,2025-08-05 10:20:17.272411,3,3_tariffs_oil_trump_tariff,2025-08-05
Learning to live with earthquakes: Lessons from around the world,2025-08-05 10:20:17.272414,1,1_russia_russian_ukraine_moscow,2025-08-05
United Nations High-Level International Conference - New York Declaration on the Peaceful Settlement of the Question of Palestine and the Implementation of the Two-State solution (29 July 2025),2025-08-04 12:52:53.000000,2,2_gaza_israeli_hostages_israel,2025-08-04
Situation of Mme Nour Attaalah (3 August 2025),2025-08-04 12:12:57.000000,9,9_summer_festival_ancient_august,2025-08-04
Israel/Palestinian Territories: Broadcasting of videos of Israeli hostages held by Hamas (2 August 2025),2025-08-04 12:11:47.000000,2,2_gaza_israeli_hostages_israel,2025-08-04
Joint Statement – Iranian State Threatss (31.07.25),2025-07-31 17:59:38.000000,-1,-1_china_ai_news24_new,2025-07-31
Ukraine – Condemnation of massive Russian airstrikes targeting Ukrainian cities (31.07.25),2025-07-31 16:07:43.000000,1,1_russia_russian_ukraine_moscow,2025-07-31
Anna Politkovskaya-Arman Soldin Prize for Courage in Journalism – Call for applications,2025-07-31 09:54:22.000000,1,1_russia_russian_ukraine_moscow,2025-07-31
"UN – Two-State Solution Conference – Meeting between Minister for Europe and Foreign Affairs Jean-Noël Barrot and UN Secretary-General António Guterres (July 30, 2025)",2025-07-30 17:00:11.000000,6,6_france_uk_boats_returns france,2025-07-30
Israel / Palestinian Territories : Joint statement of the Ministers of Foreign Affairs - New York Call (29.07.25),2025-07-30 00:21:27.000000,2,2_gaza_israeli_hostages_israel,2025-07-30
30th session of the International Seabed Authority (ISA) Assembly and Council (25.07.25),2025-07-29 17:04:58.000000,6,6_france_uk_boats_returns france,2025-07-29
"Israel/Palestinian Territories – Murder of Odeh Hathalin in the West Bank (July 29, 2025)",2025-07-29 16:53:29.000000,2,2_gaza_israeli_hostages_israel,2025-07-29
'Sinwar killed peace': Grandson of Israeli hostages urges 'to work back towards path' to peace,2025-08-05 09:54:40.000000,2,2_gaza_israeli_hostages_israel,2025-08-05
Brazil's Supreme Court orders house arrest for former President Bolsonaro,2025-08-05 09:32:18.000000,5,5_bolsonaro_house arrest_house_arrest,2025-08-05
Israeli PM Netanyahu seeks to expand Gaza operations,2025-08-05 09:30:13.000000,2,2_gaza_israeli_hostages_israel,2025-08-05
Making sport accessible in South Africa: Former SA coach builds cricket facilities for children,2025-08-05 09:26:59.000000,-1,-1_china_ai_news24_new,2025-08-05
Fans gather in Poland for International piano festival,2025-08-05 09:21:30.000000,9,9_summer_festival_ancient_august,2025-08-05
Eurostar still faces delays as high-speed train travel resumes in northern France,2025-08-05 09:14:04.000000,6,6_france_uk_boats_returns france,2025-08-05
"UK to begin migrant returns to France under 'one in, one out' deal",2025-08-05 08:45:53.000000,6,6_france_uk_boats_returns france,2025-08-05
Trump threatens India with high tariffs over Russian oil,2025-08-05 08:42:19.000000,3,3_tariffs_oil_trump_tariff,2025-08-05
Brazil judge places former president Bolsonaro under house arrest,2025-08-05 08:39:32.000000,5,5_bolsonaro_house arrest_house_arrest,2025-08-05
Trump envoy to visit Moscow before deadline for ending Ukraine war,2025-08-05 08:35:11.000000,1,1_russia_russian_ukraine_moscow,2025-08-05
Serious mood and fewer perks: Silicon Valley enters its 'hard tech' era,2025-08-05 08:28:47.000000,-1,-1_china_ai_news24_new,2025-08-05
Israel to partially reopen Gaza private sector trade as Netanyahu prepares updated war plan,2025-08-05 08:20:21.000000,2,2_gaza_israeli_hostages_israel,2025-08-05
Texas governor vows to arrest absent Democrats blocking redistricting vote,2025-08-05 06:55:33.000000,-1,-1_china_ai_news24_new,2025-08-05
"Amid desperation in war-torn Gaza, 'environment of fear, intimidation and worry in West Bank'",2025-08-05 06:54:41.000000,2,2_gaza_israeli_hostages_israel,2025-08-05
Live: Israel to partially reopen Gaza private sector trade as Netanyahu prepares updated war plan,2025-08-05 06:29:49.000000,2,2_gaza_israeli_hostages_israel,2025-08-05
"The Bright Side: Gabon's ancient caves shed light on 27,000 years of human history",2025-08-05 06:21:21.000000,9,9_summer_festival_ancient_august,2025-08-05
Trump's DOJ to open grand jury probe into Obama officials over 'Russiagate',2025-08-05 05:41:45.000000,1,1_russia_russian_ukraine_moscow,2025-08-05
"Hato new Chelsea's signing, Fritz made history in Toronto",2025-08-05 05:14:05.000000,-1,-1_china_ai_news24_new,2025-08-05
A 'plastic-free future'? UN plastic pollution talks kick off in Geneva,2025-08-05 02:53:10.000000,3,3_tariffs_oil_trump_tariff,2025-08-05
Brazil judge places former president Bolsonaro under house arrest,2025-08-04 23:05:15.000000,5,5_bolsonaro_house arrest_house_arrest,2025-08-04
Dozens dead after migrant boat sinks off Yemen coast,2025-08-04 21:02:53.000000,-1,-1_china_ai_news24_new,2025-08-04
"‘Sami rights are at risk’: Reindeer herders, environmentalists oppose mine in Norway's Arctic",2025-08-04 20:25:58.000000,-1,-1_china_ai_news24_new,2025-08-04
Hong Kong deploys 3 robotic ‘water-pumping dragons’ to drain 24 floods,2025-08-05 10:18:25.000000,0,0_hong_kong_hong kong_china,2025-08-05
PLA showcases amphibious attacks on Taiwan in latest episode of documentary,2025-08-05 10:00:18.000000,0,0_hong_kong_hong kong_china,2025-08-05
"Alibaba, ByteDance kick off campus recruitment campaigns as AI drives growth",2025-08-05 10:00:15.000000,-1,-1_china_ai_news24_new,2025-08-05
China scammers con man by posing as 1 woman using voice changers; victim calls police,2025-08-05 10:00:11.000000,0,0_hong_kong_hong kong_china,2025-08-05
Chinese tourists stranded while rafting in valley,2025-08-05 09:15:13.000000,-1,-1_china_ai_news24_new,2025-08-05
Revealed: the Li family home of 6 decades and focus of social media hoax,2025-08-05 09:00:17.000000,-1,-1_china_ai_news24_new,2025-08-05
"Alibaba, Beijing United Family Hospital partner to use AI in cancer diagnosis",2025-08-05 09:00:07.000000,-1,-1_china_ai_news24_new,2025-08-05
"China’s high-speed rail nears 50,000km milestone – but is it sustainable?",2025-08-05 09:00:03.000000,0,0_hong_kong_hong kong_china,2025-08-05
"China needs smarter, not less, investment to unlock household demand",2025-08-05 08:30:08.000000,0,0_hong_kong_hong kong_china,2025-08-05
Beijing ‘on high alert’ for disruption after Philippine-India navy patrol: PLA,2025-08-05 08:10:50.000000,0,0_hong_kong_hong kong_china,2025-08-05
Philippines rejects Chinese ‘fake news’ broadcast of South China Sea clash,2025-08-05 08:00:13.000000,0,0_hong_kong_hong kong_china,2025-08-05
Elderly man arrested in Hong Kong for allegedly assaulting bus driver,2025-08-05 07:46:42.000000,0,0_hong_kong_hong kong_china,2025-08-05
Malaysian influencers’ chicken bones prank on homeless man sparks police probe,2025-08-05 07:45:52.000000,0,0_hong_kong_hong kong_china,2025-08-05
Chinese city orders real-name registration for chikungunya fever medication,2025-08-05 07:28:36.000000,0,0_hong_kong_hong kong_china,2025-08-05
Malaysia’s US tariff deal comes with a US$240 billion price tag,2025-08-05 06:44:27.000000,3,3_tariffs_oil_trump_tariff,2025-08-05
France’s struggling factories need investment. Is China the answer?,2025-08-05 06:00:14.000000,-1,-1_china_ai_news24_new,2025-08-05
"China university plans nation’s first BBQ research centre to train 1,000 ‘craftsmen’",2025-08-05 06:00:09.000000,0,0_hong_kong_hong kong_china,2025-08-05
A&E services at Hong Kong’s Queen Mary Hospital resume after Pok Fu Lam flooded,2025-08-05 05:10:25.000000,0,0_hong_kong_hong kong_china,2025-08-05
Hong Kong downgrades second-longest black rainstorm signal on record to amber – as it happened,2025-08-05 05:07:02.000000,0,0_hong_kong_hong kong_china,2025-08-05
"East Asia’s record heat, Singapore F1 tycoon admits guilt: 7 Asia highlights",2025-08-05 04:15:09.000000,0,0_hong_kong_hong kong_china,2025-08-05
"What do we know about China’s most advanced early warning plane, the KL-3000?",2025-08-05 04:00:08.000000,0,0_hong_kong_hong kong_china,2025-08-05
Hong Kong police on the hunt for man who used fake bills to buy luxury watches,2025-08-05 03:55:09.000000,0,0_hong_kong_hong kong_china,2025-08-05
‘Deeply regressive’: sanitary pad protest stirs outrage in Malaysia,2025-08-05 03:33:39.000000,0,0_hong_kong_hong kong_china,2025-08-05
"Hong Kong police investigate headless, dismembered body found in Mid-Levels",2025-08-05 03:17:09.000000,0,0_hong_kong_hong kong_china,2025-08-05
"China wants people to eat more high-quality beef, unveils quality-grading system",2025-08-05 03:00:09.000000,0,0_hong_kong_hong kong_china,2025-08-05
Will Hong Kong firms feel US tariff pinch? Trade council head cautious but upbeat,2025-08-05 01:30:12.000000,3,3_tariffs_oil_trump_tariff,2025-08-05
"Taiwan could run out of energy in 10 days under PLA blockade, report warns",2025-08-05 01:00:16.000000,0,0_hong_kong_hong kong_china,2025-08-05
"‘I can swim’: China husband tells flood rescuers to save wife first, touches hearts",2025-08-05 01:00:08.000000,0,0_hong_kong_hong kong_china,2025-08-05
Black rainstorm warning to stay in force in Hong Kong until 5pm,2025-08-05 00:44:44.000000,0,0_hong_kong_hong kong_china,2025-08-05
Wellcome supermarket is on a drive to win Hongkongers back from Shenzhen,2025-08-05 00:30:07.000000,0,0_hong_kong_hong kong_china,2025-08-05
‘Sentimental words’: why North Korea dismisses South’s removing of loudspeakers,2025-08-05 00:00:07.000000,-1,-1_china_ai_news24_new,2025-08-05
Hong Kong trade promoter to form ‘strategic alliance’ with Bank of China,2025-08-04 23:30:08.000000,0,0_hong_kong_hong kong_china,2025-08-04
China’s Hainan eyes medical tourism boom after South Korea scraps tax perks,2025-08-04 23:00:16.000000,0,0_hong_kong_hong kong_china,2025-08-04
‘Too far ahead’: can the US upskill to compete with China on rare earths?,2025-08-04 22:00:08.000000,0,0_hong_kong_hong kong_china,2025-08-04
China opens door to Brazilian coffee as US slaps on new tariff,2025-08-04 21:52:16.000000,3,3_tariffs_oil_trump_tariff,2025-08-04
‘Hong Kong taxis to be barred from High Island Reservoir hotspot at peak times’,2025-08-04 15:37:58.000000,0,0_hong_kong_hong kong_china,2025-08-04
"Hong Kong employers’ group urges domestic helper wage freeze, cites poor economy",2025-08-04 14:26:55.000000,0,0_hong_kong_hong kong_china,2025-08-04
Is Singapore’s parliament tame? WP’s Pritam Singh says it’s just ‘pragmatic’,2025-08-04 14:07:40.000000,0,0_hong_kong_hong kong_china,2025-08-04
China’s air force looks to ‘kill chain’ to help older jets down newer models,2025-08-04 14:00:10.000000,0,0_hong_kong_hong kong_china,2025-08-04
Another storm brews for CK Hutchison under Panama ports partnership proposal,2025-08-04 13:51:01.000000,0,0_hong_kong_hong kong_china,2025-08-04
‘Western hegemony is over’; lessons from Ukraine war: SCMP daily highlights,2025-08-04 13:15:07.000000,1,1_russia_russian_ukraine_moscow,2025-08-04
Alibaba’s maps app gets an AI upgrade with Qwen-powered agent,2025-08-04 13:00:15.000000,-1,-1_china_ai_news24_new,2025-08-04
Baidu partners with Lyft to launch robotaxis in UK and Germany,2025-08-04 12:00:13.000000,-1,-1_china_ai_news24_new,2025-08-04
Top-tier mathematician Li Hanfeng leaves US for China’s Chongqing University,2025-08-04 12:00:09.000000,0,0_hong_kong_hong kong_china,2025-08-04
CLP Holdings sees growth in Tuen Mun industrial park as first-half profit falls,2025-08-04 12:00:06.000000,3,3_tariffs_oil_trump_tariff,2025-08-04
Hong Kong records 56% more monthly rainfall in July thanks to Typhoon Wipha,2025-08-04 11:48:03.000000,0,0_hong_kong_hong kong_china,2025-08-04
Hong Kong’s residential property transactions fall in July from June,2025-08-04 11:15:10.000000,0,0_hong_kong_hong kong_china,2025-08-04
Taiwan and mainland China coastguards engage in close Dongsha Island encounter,2025-08-04 11:00:13.000000,0,0_hong_kong_hong kong_china,2025-08-04
Beijing’s E-Town offers subsidies to robot buyers as China embraces humanoids,2025-08-04 11:00:09.000000,0,0_hong_kong_hong kong_china,2025-08-04
"Li mansion in Deep Water Bay is ‘not for sale’, CK Asset says in rebuke",2025-08-04 10:38:10.000000,-1,-1_china_ai_news24_new,2025-08-04
"More extreme weather expected due to climate change, ex-Observatory official says after week’s 4th black rain signal",2025-08-05 10:10:32.000000,0,0_hong_kong_hong kong_china,2025-08-05
Far-right German lawmaker’s ex-aide on trial for spying for China,2025-08-05 08:51:43.000000,-1,-1_china_ai_news24_new,2025-08-05
Hong Kong gov’t to look into inaccurate flag design used at rope-skipping competition in Japan,2025-08-05 07:43:27.000000,0,0_hong_kong_hong kong_china,2025-08-05
Hong Kong company barred from hiring non-local labour after rejecting local applicants,2025-08-05 06:12:56.000000,0,0_hong_kong_hong kong_china,2025-08-05
Widespread flooding hits Hong Kong as Observatory issues 4th black rainstorm warning in a week,2025-08-05 04:52:08.000000,0,0_hong_kong_hong kong_china,2025-08-05
"Man found guilty of desecrating Chinese, Hong Kong flags seeks to overturn conviction at city’s apex court",2025-08-04 23:30:00.000000,0,0_hong_kong_hong kong_china,2025-08-04
Beijing issues new storm warning after deadly floods,2025-08-04 11:18:08.000000,0,0_hong_kong_hong kong_china,2025-08-04
Fans of K-pop star G-Dragon scammed out of HK$610k in fake tickets for Hong Kong concerts,2025-08-04 09:47:01.000000,0,0_hong_kong_hong kong_china,2025-08-04
Australian police charge Chinese national with ‘foreign interference’ over alleged spying for Beijing,2025-08-04 08:28:33.000000,0,0_hong_kong_hong kong_china,2025-08-04
"‘We are workers, we are not slaves’: Hong Kong migrant domestic workers protest for ‘living wage’",2025-08-04 08:10:46.000000,0,0_hong_kong_hong kong_china,2025-08-04
Hong Kong cancels passports of 12 activists wanted under nat. sec law after involvement with overseas group,2025-08-04 06:29:41.000000,0,0_hong_kong_hong kong_china,2025-08-04
"Hong Kong may see surplus in current financial year, defying previous forecasts of continuing deficit",2025-08-04 05:15:40.000000,0,0_hong_kong_hong kong_china,2025-08-04
Hong Kong records first imported case of chikungunya fever after outbreak in mainland China,2025-08-03 23:30:00.000000,0,0_hong_kong_hong kong_china,2025-08-03
China and Russia start joint drills in Sea of Japan,2025-08-03 12:33:01.000000,-1,-1_china_ai_news24_new,2025-08-03
EU condemns arrest of former Macau pro-democracy lawmaker,2025-08-03 03:22:10.000000,0,0_hong_kong_hong kong_china,2025-08-03
Fruit and vegetables now defy the seasons – with one exception: the lychee,2025-08-03 01:00:00.000000,9,9_summer_festival_ancient_august,2025-08-03
"Explainer: Hong Kong same-sex partners bill – LGBTQ activists’ reactions, lawmakers’ debates, and what’s next",2025-08-03 00:00:00.000000,0,0_hong_kong_hong kong_china,2025-08-03
11 new arrests over fatal Serbian train station disaster involving 2 Chinese companies,2025-08-02 07:00:00.000000,-1,-1_china_ai_news24_new,2025-08-02
‘We are not idealists’: Hong Kong activists face tough compromise over LGBTQ rights blueprint,2025-08-02 02:00:00.000000,0,0_hong_kong_hong kong_china,2025-08-02
"HKFP Monitor August 2, 2025: Advocacy space shrinks as LGBTQ event axed, academia falls in line",2025-08-02 01:00:00.000000,0,0_hong_kong_hong kong_china,2025-08-02
"Attacker wounds Japanese national in China with rock, Tokyo embassy says",2025-08-01 12:41:06.000000,-1,-1_china_ai_news24_new,2025-08-01
Hong Kong man arrested for allegedly threatening media outlets to publish ‘seditious’ report,2025-08-01 11:55:07.000000,0,0_hong_kong_hong kong_china,2025-08-01
UK to ‘never allow’ political extradition of Hongkongers after alarm over law changes,2025-08-01 11:33:20.000000,0,0_hong_kong_hong kong_china,2025-08-01
"Nvidia says no ‘backdoors’ in chips allowing remote access, as China questions security",2025-08-01 10:22:46.000000,0,0_hong_kong_hong kong_china,2025-08-01
"Hong Kong harbour protection group disbands after 30 years, citing reclamation law changes",2025-08-01 09:37:49.000000,0,0_hong_kong_hong kong_china,2025-08-01
Taiwan vows to seek lower tariff after Trump’s ‘temporary’ 20% levy,2025-08-01 07:25:53.000000,3,3_tariffs_oil_trump_tariff,2025-08-01
"Chikungunya fever poses ‘medium to high risk’ of local transmission, warns Hong Kong health official",2025-08-01 06:21:58.000000,0,0_hong_kong_hong kong_china,2025-08-01
"Gov’t-supported youth climate scheme accepting funds from ExxonMobil, world’s 5th largest historic polluter",2025-08-01 06:20:20.000000,3,3_tariffs_oil_trump_tariff,2025-08-01
"Unsolicited free delivery of state-run China Daily copies to UK Parliament halted after review, says MP",2025-08-01 05:06:37.000000,0,0_hong_kong_hong kong_china,2025-08-01
Transport Department appeals against ruling that overturned refusal of hire car permits to prospective Uber drivers,2025-08-01 04:33:04.000000,0,0_hong_kong_hong kong_china,2025-08-01
La Xiqueñada: A first-timer’s guide to Xico’s raucous weeks-long festival,2025-08-05 08:36:07.000000,9,9_summer_festival_ancient_august,2025-08-05
Sheinbaum pushes back on claims of strained US security relations: Monday’s mañanera recapped,2025-08-05 00:58:00.000000,-1,-1_china_ai_news24_new,2025-08-05
"After another round of successful negotiations, what is Mexico doing to achieve permanent tariff relief?",2025-08-05 00:36:26.000000,4,4_mexico_mexican_stocks_peso,2025-08-05
Shakira has sold a record-breaking 1 million tickets in Mexico,2025-08-04 23:53:39.000000,4,4_mexico_mexican_stocks_peso,2025-08-04
Mexico asks US to extradite former daycare owner convicted of manslaughter,2025-08-04 22:16:16.000000,4,4_mexico_mexican_stocks_peso,2025-08-04
Baja California Sur becomes first state to legalize swimming with orcas,2025-08-04 21:08:09.000000,4,4_mexico_mexican_stocks_peso,2025-08-04
"The fun, friendly and frugal way to travel within (and outside) Mexico",2025-08-04 20:43:22.000000,4,4_mexico_mexican_stocks_peso,2025-08-04
What to cook this August,2025-08-04 19:43:31.000000,9,9_summer_festival_ancient_august,2025-08-04
Sailboat carrying US $381M in drugs from Mexico intercepted in French Polynesia,2025-08-04 18:38:46.000000,4,4_mexico_mexican_stocks_peso,2025-08-04
"Remittances to Mexico plummet 16.2% in June, the biggest drop in over a decade",2025-08-04 18:19:10.000000,4,4_mexico_mexican_stocks_peso,2025-08-04
‘People are scared to go out’: fear of Ice agents forces cancellation of US summer festivals,2025-08-04 11:12:48.000000,9,9_summer_festival_ancient_august,2025-08-04
Ten lessons the Aztecs can teach us today |  Sebastian Purcell,2025-08-04 10:00:03.000000,4,4_mexico_mexican_stocks_peso,2025-08-04
Trump imposes sweeping new tariffs on dozens of countries in latest bid to reshape global trade,2025-08-01 01:37:26.000000,3,3_tariffs_oil_trump_tariff,2025-08-01
Sheinbaum demands return of Mexican citizens held at ‘Alligator Alcatraz’,2025-07-30 18:20:59.000000,4,4_mexico_mexican_stocks_peso,2025-07-30
Tariffs and judicial chaos shake investor confidence in Mexico: ‘Everything has been put on hold’,2025-07-30 11:00:01.000000,4,4_mexico_mexican_stocks_peso,2025-07-30
It is a potentially lethal chemical – but even Mexico’s cartels can’t resist the lure of mercury,2025-07-24 17:00:33.000000,4,4_mexico_mexican_stocks_peso,2025-07-24
"Advocates demand closure of ‘Alligator Alcatraz’, citing appalling conditions",2025-07-22 21:04:11.000000,4,4_mexico_mexican_stocks_peso,2025-07-22
Is it safe to use magic mushrooms while pregnant? One woman’s quest raises questions,2025-07-16 10:00:45.000000,-1,-1_china_ai_news24_new,2025-07-16
Backlash against Mexico City gentrification echoes global anger at overtourism and rising rents,2025-07-15 12:00:33.000000,4,4_mexico_mexican_stocks_peso,2025-07-15
"Farm worker who died after California Ice raid was ‘hardworking and innocent’, family says",2025-07-14 20:16:52.000000,2,2_gaza_israeli_hostages_israel,2025-07-14
"Trump’s latest tariffs ‘are real’ unless deals improve, economic adviser says",2025-07-13 16:13:23.000000,3,3_tariffs_oil_trump_tariff,2025-07-13
Donald Trump announces 30% tariffs on goods from the EU and Mexico,2025-07-12 14:56:04.000000,3,3_tariffs_oil_trump_tariff,2025-07-12
