title,date,topic,topic_name,period
Home secretary won't say how many migrants will be returned to France in new scheme,2025-08-05 09:40:41.000000,6,6_france_uk_boats_returns france,2025-08-05
The Repair Shop's Jay Blades charged with rape,2025-08-05 08:44:17.000000,2,2_gaza_israeli_hostages_israel,2025-08-05
"Putin and Trump's relationship has soured - but behind the posturing, a Ukraine deal is still possible",2025-08-04 23:22:06.000000,1,1_russia_russian_ukraine_moscow,2025-08-04
Thousands without power and trains suspended in wake of Storm Floris,2025-08-05 09:27:24.000000,6,6_france_uk_boats_returns france,2025-08-05
"Disfigured, shamed and forgotten: BBC visits the Korean survivors of the Hiroshima bomb",2025-08-04 22:04:35.000000,-1,-1_china_ai_news24_new,2025-08-04
£100m of premium bond prizes remain unclaimed,2025-08-05 00:59:32.000000,-1,-1_china_ai_news24_new,2025-08-05
"Police should be more transparent about suspects' ethnicity, home secretary says",2025-08-05 08:33:38.000000,-1,-1_china_ai_news24_new,2025-08-05
Footballer Thomas Partey granted bail on rape charges,2025-08-05 09:22:12.000000,-1,-1_china_ai_news24_new,2025-08-05
Danish zoo asks for unwanted pets to feed its predators,2025-08-04 19:45:12.000000,-1,-1_china_ai_news24_new,2025-08-04
Trump attacks 'woke' Jaguar as firm names new boss,2025-08-05 04:44:27.000000,-1,-1_china_ai_news24_new,2025-08-05
"He is a human skeleton, Gaza hostage's brother tells BBC",2025-08-04 17:05:21.000000,2,2_gaza_israeli_hostages_israel,2025-08-04
'Totally torn apart': How decline of Morecambe FC threatens a whole community,2025-08-04 17:36:12.000000,-1,-1_china_ai_news24_new,2025-08-04
Why Donald Trump is talking about actress Sydney Sweeney,2025-08-05 00:50:00.000000,0,0_hong_kong_hong kong_china,2025-08-05
Miracle product or pollution nightmare? Why a deal to cut plastic waste is hard to reach,2025-08-05 04:03:43.000000,3,3_tariffs_oil_trump_tariff,2025-08-05
My twin sister and nieces were shot dead. Tighter gun rules make me feel hopeful,2025-08-04 23:45:58.000000,2,2_gaza_israeli_hostages_israel,2025-08-04
Who pressed their Ashes case? Who disappointed? England's player ratings,2025-08-04 15:24:14.000000,-1,-1_china_ai_news24_new,2025-08-04
"Chris Hemsworth on facing fears, ageing and return of Thor",2025-08-04 23:08:47.000000,-1,-1_china_ai_news24_new,2025-08-04
Adoption support charity shreds 'irreplaceable' files to save space,2025-08-05 05:19:28.000000,2,2_gaza_israeli_hostages_israel,2025-08-05
Texas Republicans vote to arrest Democrats blocking plan to re-draw electoral boundaries,2025-08-05 08:59:51.000000,-1,-1_china_ai_news24_new,2025-08-05
"Patients stopping obesity jabs need help to keep weight off, NHS told",2025-08-04 23:00:10.000000,-1,-1_china_ai_news24_new,2025-08-04
I'm a bodybuilder but bowel cancer in my 30s nearly killed me,2025-08-05 04:58:50.000000,-1,-1_china_ai_news24_new,2025-08-05
Police officer accused of sharing Manchester Airport brawl CCTV footage,2025-08-05 09:12:50.000000,0,0_hong_kong_hong kong_china,2025-08-05
BP says it makes biggest oil and gas find in 25 years,2025-08-05 09:01:29.000000,3,3_tariffs_oil_trump_tariff,2025-08-05
Love Island 2025 winners revealed after drama-filled series,2025-08-04 22:39:18.000000,-1,-1_china_ai_news24_new,2025-08-04
BBC News app,2025-04-30 14:04:28.000000,7,7_room newsletter_newsletter_war room_room,2025-04-30
Why has Sydney Sweeney's jeans ad sparked a race debate?,2025-08-04 17:53:00.000000,-1,-1_china_ai_news24_new,2025-08-04
The Battle For Car Finance Compensation,2025-08-01 18:28:00.000000,-1,-1_china_ai_news24_new,2025-08-01
Documents are discovered from the Moors Murders,2025-07-30 05:00:00.000000,2,2_gaza_israeli_hostages_israel,2025-07-30
'Winning the Ashes would be Stokes' greatest miracle',2025-08-05 05:18:19.000000,-1,-1_china_ai_news24_new,2025-08-05
'Excellent prospect' Ngumoha stars for Liverpool - but who is the 16-year-old?,2025-08-04 21:00:52.000000,-1,-1_china_ai_news24_new,2025-08-04
'I needed to get myself together' - Fitzpatrick on finding form,2025-08-05 05:35:30.000000,-1,-1_china_ai_news24_new,2025-08-05
Will McLaren be worried about Norris-Piastri relationship?,2025-08-05 06:45:52.000000,-1,-1_china_ai_news24_new,2025-08-05
Mboko reaches semis to continue dream Montreal run,2025-08-05 06:34:50.000000,-1,-1_china_ai_news24_new,2025-08-05
The final year of The Hundred as we know it?,2025-08-05 08:21:31.000000,-1,-1_china_ai_news24_new,2025-08-05
Scores dead as boat carrying more than 150 people capsizes off Yemen,2025-08-04 15:26:52.000000,-1,-1_china_ai_news24_new,2025-08-04
Gunmen kidnap more than 50 people in north-west Nigeria,2025-08-03 18:10:46.000000,2,2_gaza_israeli_hostages_israel,2025-08-03
Family of Kenyan woman allegedly murdered by UK soldiers criticise defence secretary,2025-08-03 14:00:42.000000,-1,-1_china_ai_news24_new,2025-08-03
Kemi Badenoch says she no longer sees herself as Nigerian despite upbringing,2025-08-01 17:17:49.000000,-1,-1_china_ai_news24_new,2025-08-01
Rhino horns made radioactive to foil traffickers in South African project,2025-07-31 21:52:16.000000,-1,-1_china_ai_news24_new,2025-07-31
Scientists identify bacterium behind devastating wasting disease in starfish,2025-08-05 06:57:17.000000,-1,-1_china_ai_news24_new,2025-08-05
US condemns Brazil supreme court judge for ordering house arrest of ex-president Jair Bolsonaro,2025-08-04 22:25:37.000000,5,5_bolsonaro_house arrest_house_arrest,2025-08-04
"Nine missing, including child and Irish missionary, after mass kidnapping at Haiti orphanage",2025-08-04 20:55:54.000000,2,2_gaza_israeli_hostages_israel,2025-08-04
Canada wildfires prompt severe air quality alerts across country and US,2025-08-04 17:55:49.000000,-1,-1_china_ai_news24_new,2025-08-04
BP makes its biggest oil and gas discovery in 25 years off coast of Brazil,2025-08-04 13:56:14.000000,3,3_tariffs_oil_trump_tariff,2025-08-04
‘Don’t erase the soul of Bingin’: Bali locals dismayed as 48 businesses destroyed in local crackdown,2025-08-04 15:00:35.000000,-1,-1_china_ai_news24_new,2025-08-04
Weather tracker: Heat records fall as Japan and South Korea swelter,2025-08-04 11:05:57.000000,0,0_hong_kong_hong kong_china,2025-08-04
New Zealand to charge foreign tourists to visit most famous sites,2025-08-04 04:36:35.000000,-1,-1_china_ai_news24_new,2025-08-04
South Korea begins removing loudspeakers on border with North to reduce tensions,2025-08-04 03:56:25.000000,-1,-1_china_ai_news24_new,2025-08-04
Woman arrested after allegedly travelling with two-year-old in suitcase in New Zealand,2025-08-03 17:21:21.000000,2,2_gaza_israeli_hostages_israel,2025-08-03
"Exchange student, 13, in custody after 14-year-old girl fatally stabbed at NSW host family home",2025-08-05 09:18:36.000000,2,2_gaza_israeli_hostages_israel,2025-08-05
Snowtown murderer granted parole after decades in jail for South Australia’s ‘bodies in the barrels’ serial killings,2025-08-05 08:53:42.000000,2,2_gaza_israeli_hostages_israel,2025-08-05
"Transgender woman treated as ‘hostile invader’ when joining women-only app Giggle for Girls, court hears",2025-08-05 08:26:49.000000,0,0_hong_kong_hong kong_china,2025-08-05
‘Grave’ fears for missing couple and dog after plane vanishes flying from Tasmania to NSW,2025-08-05 08:02:34.000000,2,2_gaza_israeli_hostages_israel,2025-08-05
Qantas frequent flyer points devalued as airline rolls out changes to loyalty program,2025-08-05 08:02:02.000000,-1,-1_china_ai_news24_new,2025-08-05
Ukraine calls for greater pressure on Russia ahead of Witkoff visit – Europe live,2025-08-05 10:02:42.000000,1,1_russia_russian_ukraine_moscow,2025-08-05
Guinness owner Diageo’s profits slump as it warns of $200m Trump tariff hit,2025-08-05 08:42:13.000000,3,3_tariffs_oil_trump_tariff,2025-08-05
Shein fined €1m in Italy for misleading environmental claims about products,2025-08-05 05:00:42.000000,3,3_tariffs_oil_trump_tariff,2025-08-05
Pension age debate threatens to splinter Germany’s fragile coalition,2025-08-05 04:00:41.000000,8,8_germany_germanys_pension_age,2025-08-05
UK to start small boats returns to France ‘within days’ after EU gives green light,2025-08-04 21:30:33.000000,6,6_france_uk_boats_returns france,2025-08-04
Israel-Gaza war live: Netanyahu to meet security cabinet to decide on next steps in war,2025-08-05 09:56:25.000000,2,2_gaza_israeli_hostages_israel,2025-08-05
‘Heartbreaking’: a London surgeon on the trials of operating in a Gaza hospital,2025-08-05 08:40:18.000000,2,2_gaza_israeli_hostages_israel,2025-08-05
100 Gaza children hope to be evacuated to UK for urgent medical care,2025-08-05 05:00:43.000000,2,2_gaza_israeli_hostages_israel,2025-08-05
More than 40 arrested at protest against Gaza war at Trump hotel in New York,2025-08-05 02:19:26.000000,2,2_gaza_israeli_hostages_israel,2025-08-05
House Democrats sign on to letter urging Trump to recognise Palestinian statehood,2025-08-05 00:13:01.000000,2,2_gaza_israeli_hostages_israel,2025-08-05
Trump’s demand that India stop buying Russian oil puts Modi in tight spot,2025-08-04 16:49:07.000000,-1,-1_china_ai_news24_new,2025-08-04
Suspected gunmen go on trial in Moscow over concert hall terror attack,2025-08-04 11:30:52.000000,1,1_russia_russian_ukraine_moscow,2025-08-04
"India to still buy oil from Russia despite Trump threats, say officials",2025-08-02 12:48:08.000000,3,3_tariffs_oil_trump_tariff,2025-08-02
Myanmar junta ends state of emergency as it prepares for elections,2025-07-31 07:36:37.000000,0,0_hong_kong_hong kong_china,2025-07-31
‘A joyous day’: India celebrates return of ancient gems linked to the Buddha,2025-07-31 04:00:39.000000,9,9_summer_festival_ancient_august,2025-07-31
Yvette Cooper says ‘crammed’ small boats using shallow water launches behind rise in arrival numbers – UK politics live,2025-08-05 10:04:46.000000,6,6_france_uk_boats_returns france,2025-08-05
Jeremy Corbyn warns new rules on council asset sales threaten allotments,2025-08-05 09:50:16.000000,-1,-1_china_ai_news24_new,2025-08-05
Trump attacks ‘seriously woke’ Jaguar Land Rover as company names new CEO,2025-08-05 08:42:07.000000,5,5_bolsonaro_house arrest_house_arrest,2025-08-05
"Guidance on police disclosing suspects’ ethnicity should change, Cooper says",2025-08-05 08:36:56.000000,-1,-1_china_ai_news24_new,2025-08-05
TV presenter Jay Blades charged with two counts of rape,2025-08-05 08:25:43.000000,2,2_gaza_israeli_hostages_israel,2025-08-05
Spirit Airlines pilot ‘removed from duty’ after being arrested on stalking charges,2025-08-05 10:00:54.000000,2,2_gaza_israeli_hostages_israel,2025-08-05
Texas redistricting standoff escalates with threat to arrest absent Democrats – US politics live,2025-08-05 09:53:48.000000,-1,-1_china_ai_news24_new,2025-08-05
"Trump firing of statistics chief puts US data credibility at risk, experts warn",2025-08-05 09:00:54.000000,-1,-1_china_ai_news24_new,2025-08-05
The one thing Donald Trump isn’t saying about tariffs,2025-08-05 09:00:54.000000,3,3_tariffs_oil_trump_tariff,2025-08-05
"Central California issues evacuation orders after wildfire burns 72,000 acres",2025-08-05 02:06:25.000000,6,6_france_uk_boats_returns france,2025-08-05
Brazil’s former President Bolsonaro placed under house arrest,2025-08-05 09:55:10.000000,5,5_bolsonaro_house arrest_house_arrest,2025-08-05
Tendulkar leads praise for India after Test fightback in England,2025-08-05 09:16:10.000000,-1,-1_china_ai_news24_new,2025-08-05
Hezbollah supporters protest disarmament ahead of Lebanese government talks,2025-08-05 09:02:58.000000,2,2_gaza_israeli_hostages_israel,2025-08-05
Who’s seeking asylum in Europe today?,2025-08-05 08:51:38.000000,6,6_france_uk_boats_returns france,2025-08-05
Bengaluru stops salaries as India’s Super League turmoil deepens,2025-08-05 08:37:41.000000,-1,-1_china_ai_news24_new,2025-08-05
"80 years after Hiroshima atomic bombing, search for missing continues",2025-08-05 08:32:00.000000,-1,-1_china_ai_news24_new,2025-08-05
Japan logs two new highest temperatures on record in a day,2025-08-05 07:45:03.000000,0,0_hong_kong_hong kong_china,2025-08-05
"Hong Kong cancels passports, bans financial support for wanted activists",2025-08-05 05:30:17.000000,0,0_hong_kong_hong kong_china,2025-08-05
"Australia, Japan strike largest defence deal for advanced warships",2025-08-05 05:25:45.000000,-1,-1_china_ai_news24_new,2025-08-05
"Israel’s Netanyahu has decided on full occupation of Gaza, reports say",2025-08-05 03:14:46.000000,2,2_gaza_israeli_hostages_israel,2025-08-05
Australia’s FM warns of ‘risk there will be no Palestine left to recognise’,2025-08-05 03:05:58.000000,2,2_gaza_israeli_hostages_israel,2025-08-05
Bangladesh teeters between hope and deadlock a year after Hasina’s fall,2025-08-05 02:31:32.000000,2,2_gaza_israeli_hostages_israel,2025-08-05
Russia’s Medvedev issues warning as Moscow says not bound by missile treaty,2025-08-05 01:52:08.000000,1,1_russia_russian_ukraine_moscow,2025-08-05
"Russia-Ukraine war: List of key events, day 1,258",2025-08-05 00:15:19.000000,1,1_russia_russian_ukraine_moscow,2025-08-05
Far-right figure Tommy Robinson arrested for train station assault in UK,2025-08-04 23:14:24.000000,2,2_gaza_israeli_hostages_israel,2025-08-04
US Democrats flee Texas to block Trump-backed election redistricting,2025-08-04 22:47:37.000000,-1,-1_china_ai_news24_new,2025-08-04
"Milei vetoes pension, disability spending increases as Argentina feels cuts",2025-08-04 22:03:44.000000,8,8_germany_germanys_pension_age,2025-08-04
Palestinians distraught over relatives missing at deadly Gaza aid sites,2025-08-04 21:26:45.000000,2,2_gaza_israeli_hostages_israel,2025-08-04
Brazil Supreme Court orders house arrest of former President Bolsonaro,2025-08-04 21:24:33.000000,5,5_bolsonaro_house arrest_house_arrest,2025-08-04
Demands for justice on fifth anniversary of deadly Beirut port blast,2025-08-04 20:49:50.000000,2,2_gaza_israeli_hostages_israel,2025-08-04
US House Speaker Mike Johnson visits Israeli West Bank settlement,2025-08-04 20:26:59.000000,2,2_gaza_israeli_hostages_israel,2025-08-04
Commuters flee New Jersey train after fire breaks out,2025-08-04 19:26:03.000000,-1,-1_china_ai_news24_new,2025-08-04
Why have relations between Trump and Modi nosedived so quickly?,2025-08-04 19:15:27.000000,-1,-1_china_ai_news24_new,2025-08-04
Israel court halts gov’t firing of attorney general investigating Netanyahu,2025-08-04 18:57:39.000000,2,2_gaza_israeli_hostages_israel,2025-08-04
"Syria’s Kurdish-led SDF, government forces clash in Aleppo province",2025-08-04 18:51:29.000000,1,1_russia_russian_ukraine_moscow,2025-08-04
This Tuscan startup sold all its olive oil in the U.S. Then came Trump's tariffs,2025-08-05 09:05:00.000000,3,3_tariffs_oil_trump_tariff,2025-08-05
Trump puts pressure on Putin moving nuclear submarines closer to Russia,2025-08-05 08:08:06.000000,1,1_russia_russian_ukraine_moscow,2025-08-05
"As ceasefire talks stall, Israel's government weighs a full occupation of Gaza",2025-08-05 08:05:58.000000,2,2_gaza_israeli_hostages_israel,2025-08-05
A retired Israeli Major General on why he signed a letter to President Trump,2025-08-05 08:05:29.000000,2,2_gaza_israeli_hostages_israel,2025-08-05
India reacts as Trump promises to raise tariffs for buying Russian oil,2025-08-05 08:04:56.000000,3,3_tariffs_oil_trump_tariff,2025-08-05
Brazil's Supreme Court orders house arrest for former President Bolsonaro,2025-08-05 04:49:11.000000,5,5_bolsonaro_house arrest_house_arrest,2025-08-05
"State Department may require some visa applicants to post bond of up to $15,000",2025-08-05 03:55:27.000000,-1,-1_china_ai_news24_new,2025-08-05
The Global Impact of the Latest U.S. Tariffs,2025-08-04 20:49:02.000000,3,3_tariffs_oil_trump_tariff,2025-08-04
Videos of emaciated hostages in Gaza raise pressure on Israel for a ceasefire,2025-08-04 13:57:55.000000,2,2_gaza_israeli_hostages_israel,2025-08-04
From allies to enemies: How the 1979 revolution transformed U.S.-Iranian relations,2025-08-04 13:47:44.000000,7,7_room newsletter_newsletter_war room_room,2025-08-04
The War Room newsletter: How receiving aid became fatal in Gaza,2025-08-04 17:43:16.000000,2,2_gaza_israeli_hostages_israel,2025-08-04
Could AI tilt the outcome of elections?,2025-07-31 13:02:38.000000,-1,-1_china_ai_news24_new,2025-07-31
How spy agencies are experimenting with the newest AI models,2025-07-29 17:20:50.000000,-1,-1_china_ai_news24_new,2025-07-29
Can China save South Africa from Donald Trump?,2025-07-29 11:17:10.000000,0,0_hong_kong_hong kong_china,2025-07-29
Look inside The Economist’s summer issue for 2025,2025-07-28 17:24:58.000000,9,9_summer_festival_ancient_august,2025-07-28
The world court joins the fight over climate change,2025-07-24 14:44:29.000000,3,3_tariffs_oil_trump_tariff,2025-07-24
Rethinking the war on AIDS,2025-07-24 12:59:53.000000,-1,-1_china_ai_news24_new,2025-07-24
The surprising lessons of a secret cold-war nuclear programme,2025-07-22 20:51:43.000000,1,1_russia_russian_ukraine_moscow,2025-07-22
The War Room newsletter: Three new books on espionage,2025-07-21 16:23:54.000000,7,7_room newsletter_newsletter_war room_room,2025-07-21
The rise and rise of women’s sport,2025-07-17 12:48:23.000000,-1,-1_china_ai_news24_new,2025-07-17
Cynical realism won’t save India from Donald Trump,2025-07-15 20:16:10.000000,-1,-1_china_ai_news24_new,2025-07-15
"Gianni Infantino, FIFA’s strongman-loving boss",2025-07-11 17:35:14.000000,-1,-1_china_ai_news24_new,2025-07-11
Putin’s war in Ukraine may cost him control of the south Caucasus,2025-07-10 12:54:40.000000,1,1_russia_russian_ukraine_moscow,2025-07-10
The 19th century is a terrible guide to modern statecraft,2025-07-08 19:09:01.000000,7,7_room newsletter_newsletter_war room_room,2025-07-08
Putin’s radioactive chokehold on the world,2025-07-03 12:58:43.000000,1,1_russia_russian_ukraine_moscow,2025-07-03
How South Africa could harness Donald Trump’s wrath,2025-07-01 21:07:03.000000,0,0_hong_kong_hong kong_china,2025-07-01
The War Room newsletter: The daddy of all summits,2025-06-30 17:12:18.000000,7,7_room newsletter_newsletter_war room_room,2025-06-30
Sex work in the gig economy,2025-06-26 12:43:33.000000,-1,-1_china_ai_news24_new,2025-06-26
Feckless Europe accepts Trump’s Lone Ranger diplomacy,2025-06-24 17:37:41.000000,0,0_hong_kong_hong kong_china,2025-06-24
Can men and women be just friends?,2025-06-19 12:57:40.000000,1,1_russia_russian_ukraine_moscow,2025-06-19
"In Trumpworld, toppling rulers is taboo",2025-06-17 12:26:17.000000,0,0_hong_kong_hong kong_china,2025-06-17
The War Room newsletter: Why Israel attacked Iran—and what comes next,2025-06-13 15:41:07.000000,7,7_room newsletter_newsletter_war room_room,2025-06-13
The West has stopped losing its religion,2025-06-12 13:00:23.000000,2,2_gaza_israeli_hostages_israel,2025-06-12
Taiwan thinks the unthinkable: resisting China without America,2025-06-10 19:08:48.000000,0,0_hong_kong_hong kong_china,2025-06-10
The War Room newsletter: Britain’s defence goals are admirably absurd,2025-06-09 16:10:34.000000,7,7_room newsletter_newsletter_war room_room,2025-06-09
"To earn American help, allies are told to elect nationalists",2025-06-03 21:00:16.000000,7,7_room newsletter_newsletter_war room_room,2025-06-03
Vladimir Putin’s sickening statistic: 1m Russian casualties in Ukraine,2025-06-02 18:51:16.000000,1,1_russia_russian_ukraine_moscow,2025-06-02
The War Room newsletter: How Ukraine humbled Putin (again),2025-06-02 15:16:10.000000,1,1_russia_russian_ukraine_moscow,2025-06-02
The Uber of the underworld,2025-05-29 12:48:24.000000,-1,-1_china_ai_news24_new,2025-05-29
The War Room newsletter: Explore our “Archive 1945” project,2025-05-29 09:04:06.000000,7,7_room newsletter_newsletter_war room_room,2025-05-29
Donald Trump steals Xi Jinping’s favourite foreign policy,2025-05-27 18:33:51.000000,0,0_hong_kong_hong kong_china,2025-05-27
Can China jam your GPS?,2025-05-22 12:47:13.000000,0,0_hong_kong_hong kong_china,2025-05-22
Star wars returns,2025-05-21 17:55:03.000000,-1,-1_china_ai_news24_new,2025-05-21
"How to fight the next pandemic, without America",2025-05-20 19:34:44.000000,-1,-1_china_ai_news24_new,2025-05-20
The War Room newsletter: Shadow games in the Baltic,2025-05-19 15:52:08.000000,7,7_room newsletter_newsletter_war room_room,2025-05-19
Fact-checkers forecast which dodgy claims will do most damage,2025-05-15 12:59:07.000000,-1,-1_china_ai_news24_new,2025-05-15
China and Russia are deploying powerful new weapons: ideas,2025-05-15 11:15:12.000000,-1,-1_china_ai_news24_new,2025-05-15
Why Donald Trump is a globalist,2025-05-13 18:50:52.000000,-1,-1_china_ai_news24_new,2025-05-13
The War Room newsletter: Six must-read books on the second world war,2025-05-05 16:14:31.000000,7,7_room newsletter_newsletter_war room_room,2025-05-05
The UN could run out of cash within months,2025-05-01 12:59:11.000000,6,6_france_uk_boats_returns france,2025-05-01
Donald Trump picks the wrong trade fight with China,2025-04-29 21:07:45.000000,-1,-1_china_ai_news24_new,2025-04-29
A Trump executive order will unleash a global deep-sea mining boom,2025-04-25 17:51:49.000000,3,3_tariffs_oil_trump_tariff,2025-04-25
Why some countries are once again embracing cluster bombs,2025-04-24 12:49:36.000000,-1,-1_china_ai_news24_new,2025-04-24
The ugly task of Putin-proofing your border,2025-04-22 18:00:09.000000,1,1_russia_russian_ukraine_moscow,2025-04-22
Trump’s red-hot war on terror,2025-04-22 16:46:04.000000,0,0_hong_kong_hong kong_china,2025-04-22
The coming struggle to choose the next pope,2025-04-21 12:56:17.000000,-1,-1_china_ai_news24_new,2025-04-21
Plastics are greener than they seem,2025-04-16 13:20:45.000000,3,3_tariffs_oil_trump_tariff,2025-04-16
Xi Jinping’s Trump-sized puzzle,2025-04-15 18:01:52.000000,0,0_hong_kong_hong kong_china,2025-04-15
"The War Room newsletter: Is American diplomacy all bark, no bite?",2025-04-14 16:07:10.000000,7,7_room newsletter_newsletter_war room_room,2025-04-14
There is a vast hidden workforce behind AI,2025-04-10 09:54:26.000000,-1,-1_china_ai_news24_new,2025-04-10
Bolsonaro Takes Stand in Coup Trial,2025-06-13 23:31:37.000000,5,5_bolsonaro_house arrest_house_arrest,2025-06-13
Analysis: NYT’s bizarre coverage and omissions of Bolsonaro’s murderous coup plot,2024-12-11 11:57:00.000000,5,5_bolsonaro_house arrest_house_arrest,2024-12-11
Nathália Urban Presente!,2024-09-27 20:45:59.000000,9,9_summer_festival_ancient_august,2024-09-27
Inside Brazil’s X Ban: How Elon Musk Started–and lost–a Fight With Brazil’s Judiciary,2024-09-05 21:54:18.000000,5,5_bolsonaro_house arrest_house_arrest,2024-09-05
"Minister warns of “industrial-scale” organized disinformation campaign, hindering disaster efforts",2024-05-15 13:41:27.000000,-1,-1_china_ai_news24_new,2024-05-15
Local Government’s responsibility for Porto Alegre flood catastrophe,2024-05-12 13:09:26.000000,-1,-1_china_ai_news24_new,2024-05-12
US Congresswoman Takes Down Fantasist Republican Committee Hearing on Brazilian Democracy,2024-05-09 12:19:14.000000,5,5_bolsonaro_house arrest_house_arrest,2024-05-09
Greenwald accused of thinking he is “civilizing the natives”,2024-04-23 14:29:08.000000,4,4_mexico_mexican_stocks_peso,2024-04-23
Brazilian lawyer exposes deceit at heart of “Twitter Files”,2024-04-18 12:17:20.000000,5,5_bolsonaro_house arrest_house_arrest,2024-04-18
Elon Musk Leads Far Right Propaganda Blitz On Brazil’s Democracy,2024-04-10 20:50:54.000000,5,5_bolsonaro_house arrest_house_arrest,2024-04-10
"The New Game in Brazilian Football: Big Money, Bold Moves, and Changing the Rules",2025-08-05 10:18:50.000000,5,5_bolsonaro_house arrest_house_arrest,2025-08-05
"State Ownership Versus Market Forces: What’s Next for Cemig, Copasa, and RD Saúde?",2025-08-05 09:53:38.000000,4,4_mexico_mexican_stocks_peso,2025-08-05
"Brazil’s Housing Prices Jump as Monthly Growth Hits 0.58% in July, Outpacing Inflation",2025-08-05 09:08:30.000000,-1,-1_china_ai_news24_new,2025-08-05
Brazil Stands Firm: COP30 Will Stay in Belém Despite Rising Costs and Global Pressure,2025-08-05 09:04:36.000000,-1,-1_china_ai_news24_new,2025-08-05
Brazil’s Prio and Brava Energia Push Oil Limits Amid Technical and Market Challenges,2025-08-05 08:59:39.000000,3,3_tariffs_oil_trump_tariff,2025-08-05
Bolsonaro House Arrest Aims to Display Moraes’ Defiance to U.S. Sanctions but Risks Deepening U.S.–Brazil Rift,2025-08-05 08:58:57.000000,5,5_bolsonaro_house arrest_house_arrest,2025-08-05
"Chilean Peso Holds Ground, Santiago Stocks Steady—Copper Policy Calms Markets While Top Shares Diverge",2025-08-05 08:06:13.000000,4,4_mexico_mexican_stocks_peso,2025-08-05
"Brazil’s Financial Morning Call for August 5, 2025",2025-08-05 08:01:27.000000,-1,-1_china_ai_news24_new,2025-08-05
Tense Peso Gains and Select Stocks Lead Buenos Aires Markets Amid Volatility,2025-08-05 07:49:22.000000,4,4_mexico_mexican_stocks_peso,2025-08-05
"Peso Slides, Stocks Lose Support as Mexico’s Troubles Deepen: Standout Gainers and Losers",2025-08-05 07:37:59.000000,4,4_mexico_mexican_stocks_peso,2025-08-05
Netherlands to buy US arms for Ukraine under new NATO scheme,2025-08-05 10:20:17.272256,1,1_russia_russian_ukraine_moscow,2025-08-05
Fact check: Are X's community notes fixing or fueling misinformation?,2025-08-05 10:20:17.272264,-1,-1_china_ai_news24_new,2025-08-05
Can a global treaty solve the plastics crisis?,2025-08-05 10:20:17.272267,3,3_tariffs_oil_trump_tariff,2025-08-05
Denmark zoo asks people to donate pets to feed predators,2025-08-05 10:20:17.272270,-1,-1_china_ai_news24_new,2025-08-05
Germany updates: AfD ex-aide on trial for China espionage,2025-08-05 10:20:17.272274,-1,-1_china_ai_news24_new,2025-08-05
Middle East: Netanyahu to 'update' Gaza war plan,2025-08-05 10:20:17.272277,2,2_gaza_israeli_hostages_israel,2025-08-05
